frontstory,url
«Die Preise an den Strombörsen haben jeden Bezug zur Realität verloren»,https://www.tagesanzeiger.ch//die-preise-an-den-stromboersen-haben-jeden-bezug-zur-realitaet-verloren-112325209494
"«Man muss sich gar nicht entscheiden, ob man Albaner oder Schweizer ist»",https://www.tagesanzeiger.ch//die-preise-an-den-stromboersen-haben-jeden-bezug-zur-realitaet-verloren-112325209494
Auf einmal dreschen alle auf Habeck ein,https://www.tagesanzeiger.ch//die-preise-an-den-stromboersen-haben-jeden-bezug-zur-realitaet-verloren-112325209494
Wieso wir mitschuldig sind,https://www.tagesanzeiger.ch//die-preise-an-den-stromboersen-haben-jeden-bezug-zur-realitaet-verloren-112325209494
"Erst noch vom Trump-Lager veräppelt, gibt Joe Biden jetzt den dunklen Ritter",https://www.tagesanzeiger.ch//die-preise-an-den-stromboersen-haben-jeden-bezug-zur-realitaet-verloren-112325209494
Über 50 Grad im Death Valley erwartet – Flammen­in­ferno nahe Los Angeles,https://www.tagesanzeiger.ch//die-preise-an-den-stromboersen-haben-jeden-bezug-zur-realitaet-verloren-112325209494
