frontstory,url
Was stimmt nicht mit Italien?,https://www.tagesanzeiger.ch//was-stimmt-nicht-mit-italien-812712720626
Iraner fordern Massnahmen vom Bundesrat ,https://www.tagesanzeiger.ch//was-stimmt-nicht-mit-italien-812712720626
Vollzeitjob? Nein danke,https://www.tagesanzeiger.ch//was-stimmt-nicht-mit-italien-812712720626
Mieter zahlen mehr – und Hausverwaltungen kassieren,https://www.tagesanzeiger.ch//was-stimmt-nicht-mit-italien-812712720626
Der Fraumünster-Posträuber und die Mafia,https://www.tagesanzeiger.ch//was-stimmt-nicht-mit-italien-812712720626
Meghans Weg zur Albtraumprinzessin,https://www.tagesanzeiger.ch//was-stimmt-nicht-mit-italien-812712720626
