frontstory,url
"«Je weniger Gas wir verbrauchen, desto weniger wird die Mangellage in der Schweiz sichtbar sein»",https://www.tagesanzeiger.ch//ticker-live-bundesrat-energiekrise-gas-mangel-strom-sparziel-336816986241
Kampfjet-Abstimmung ist nicht vor Offertenschluss möglich,https://www.tagesanzeiger.ch//ticker-live-bundesrat-energiekrise-gas-mangel-strom-sparziel-336816986241
Putin hat die Gangart gewechselt,https://www.tagesanzeiger.ch//ticker-live-bundesrat-energiekrise-gas-mangel-strom-sparziel-336816986241
Die Hälfte der Omikron-Infizierten weiss nichts davon,https://www.tagesanzeiger.ch//ticker-live-bundesrat-energiekrise-gas-mangel-strom-sparziel-336816986241
"«Wenn die Russen durchbrechen, sind wir die Ersten, die dran sind»",https://www.tagesanzeiger.ch//ticker-live-bundesrat-energiekrise-gas-mangel-strom-sparziel-336816986241
Ein Bündner beendet die Schweizer Golfkrise,https://www.tagesanzeiger.ch//ticker-live-bundesrat-energiekrise-gas-mangel-strom-sparziel-336816986241
