frontstory,url
Müssen wir bei einem Ja zur AHV-Reform automatisch bis 67 arbeiten?,https://www.tagesanzeiger.ch//muessen-wir-bei-einem-ja-zur-ahv-reform-automatisch-bis-67-arbeiten-344215443472
Hinter der Trauer verbirgt sich Verunsicherung,https://www.tagesanzeiger.ch//muessen-wir-bei-einem-ja-zur-ahv-reform-automatisch-bis-67-arbeiten-344215443472
«Wir würden neu bis zu 80 Prozent unserer Obligationen im Inland ausgeben»,https://www.tagesanzeiger.ch//muessen-wir-bei-einem-ja-zur-ahv-reform-automatisch-bis-67-arbeiten-344215443472
«Der Bundesrat soll schon jetzt die Strom­mangel­lage ausrufen»,https://www.tagesanzeiger.ch//muessen-wir-bei-einem-ja-zur-ahv-reform-automatisch-bis-67-arbeiten-344215443472
"«Jetzt erschrickst du sicher, dass ich dich anrufe»",https://www.tagesanzeiger.ch//muessen-wir-bei-einem-ja-zur-ahv-reform-automatisch-bis-67-arbeiten-344215443472
Mit Kleinkindern an Bord sind sie um die Welt gesegelt,https://www.tagesanzeiger.ch//muessen-wir-bei-einem-ja-zur-ahv-reform-automatisch-bis-67-arbeiten-344215443472
