frontstory,url
"«Ich fühle mich freier, nicht mehr meiner Sexualität ausgeliefert»",https://www.tagesanzeiger.ch//ich-fuehle-mich-freier-nicht-mehr-meiner-sexualitaet-ausgeliefert-714511601969
Russischer Soldat gesteht Kriegsverbrechen in der Ukraine,https://www.tagesanzeiger.ch//ich-fuehle-mich-freier-nicht-mehr-meiner-sexualitaet-ausgeliefert-714511601969
Wenn Betagte nichts mehr sehen,https://www.tagesanzeiger.ch//ich-fuehle-mich-freier-nicht-mehr-meiner-sexualitaet-ausgeliefert-714511601969
Putins Eigentor,https://www.tagesanzeiger.ch//ich-fuehle-mich-freier-nicht-mehr-meiner-sexualitaet-ausgeliefert-714511601969
Selenski: «Russland bereitet massive Energie-Attacke vor»,https://www.tagesanzeiger.ch//ich-fuehle-mich-freier-nicht-mehr-meiner-sexualitaet-ausgeliefert-714511601969
Verstörende Bilder aus der Migros-Geflügelzucht ,https://www.tagesanzeiger.ch//ich-fuehle-mich-freier-nicht-mehr-meiner-sexualitaet-ausgeliefert-714511601969
