frontstory,url
Kiew lehrt Russland das Fürchten,https://www.tagesanzeiger.ch//kiew-lehrt-russland-das-fuerchten-198851984965
«Die Situation ändert sich gerade wieder»,https://www.tagesanzeiger.ch//kiew-lehrt-russland-das-fuerchten-198851984965
Die Axpo soll künftig aufgeteilt werden,https://www.tagesanzeiger.ch//kiew-lehrt-russland-das-fuerchten-198851984965
Erster öffentlicher Blick auf den Sarg der Queen in Schottland | Antigua und Barbuda soll Republik werden,https://www.tagesanzeiger.ch//kiew-lehrt-russland-das-fuerchten-198851984965
Was Sie über die Queen garantiert noch nicht wussten,https://www.tagesanzeiger.ch//kiew-lehrt-russland-das-fuerchten-198851984965
Der «Russinnen-Trick» wird zum Albtraum für Männer,https://www.tagesanzeiger.ch//kiew-lehrt-russland-das-fuerchten-198851984965
