frontstory,url
Sie beginnen das Medizinstudium mit einer Woche im Spital,https://www.tagesanzeiger.ch//sie-beginnen-das-medizinstudium-mit-einer-woche-im-spital-650733797701
«Wie oft müssen wir noch sagen: Wir haben nichts gegen Homosexuelle»,https://www.tagesanzeiger.ch//sie-beginnen-das-medizinstudium-mit-einer-woche-im-spital-650733797701
"Sergei Lawrow kommt zu spät, redet zu lange und verlässt umgehend den Saal ",https://www.tagesanzeiger.ch//sie-beginnen-das-medizinstudium-mit-einer-woche-im-spital-650733797701
UNO-Report: Russische Kriegs­verbrechen in der Ukraine festgestellt  Schein­referenden in be­setzten Gebieten begonnen,https://www.tagesanzeiger.ch//sie-beginnen-das-medizinstudium-mit-einer-woche-im-spital-650733797701
"Gleich geht der Protest los – und wie er ausgeht, weiss hier jeder",https://www.tagesanzeiger.ch//sie-beginnen-das-medizinstudium-mit-einer-woche-im-spital-650733797701
Die Deutschen erhalten die Gasrechnung – und werden wütend,https://www.tagesanzeiger.ch//sie-beginnen-das-medizinstudium-mit-einer-woche-im-spital-650733797701
