frontstory,url
Eine Revolte im Kreml ist unwahrscheinlich – noch ,https://www.tagesanzeiger.ch//eine-revolte-im-kreml-ist-unwahrscheinlich-noch-536349006410
Welche Varianten kommen im Winter? ,https://www.tagesanzeiger.ch//eine-revolte-im-kreml-ist-unwahrscheinlich-noch-536349006410
Van der Bellen gelingt die Wiederwahl ,https://www.tagesanzeiger.ch//eine-revolte-im-kreml-ist-unwahrscheinlich-noch-536349006410
Das Wichtigste in der Übersicht,https://www.tagesanzeiger.ch//eine-revolte-im-kreml-ist-unwahrscheinlich-noch-536349006410
1000 Fehlpässe für ein 0:0,https://www.tagesanzeiger.ch//eine-revolte-im-kreml-ist-unwahrscheinlich-noch-536349006410
"«Niemand sagte: Mensch, so kann das nicht weitergehen»",https://www.tagesanzeiger.ch//eine-revolte-im-kreml-ist-unwahrscheinlich-noch-536349006410
