frontstory,url
"Der trotzige Glaube, am längeren Hebel zu sitzen",https://www.tagesanzeiger.ch//der-trotzige-glaube-am-laengeren-hebel-zu-sitzen-675203950906
Der Bericht kam in letzter Minute – und kommt einer Verdammnis gleich,https://www.tagesanzeiger.ch//der-trotzige-glaube-am-laengeren-hebel-zu-sitzen-675203950906
Stellenabbau bei Credit Suisse | Nominallöhne dürften um 2 Prozent steigen | XXXL kauft zu,https://www.tagesanzeiger.ch//der-trotzige-glaube-am-laengeren-hebel-zu-sitzen-675203950906
Finanzamt entdeckt tausende illegale Pools – jetzt wirds teuer,https://www.tagesanzeiger.ch//der-trotzige-glaube-am-laengeren-hebel-zu-sitzen-675203950906
 Reicht eine A4-Seite als Lebensraum für ein Huhn? ,https://www.tagesanzeiger.ch//der-trotzige-glaube-am-laengeren-hebel-zu-sitzen-675203950906
"«Bundesrat Parmelin könnte vorzeigen, wie er eine Duschbrause austauscht»",https://www.tagesanzeiger.ch//der-trotzige-glaube-am-laengeren-hebel-zu-sitzen-675203950906
