frontstory,url
"«Eine Zukunft, die frei ist von Waffen­gewalt, all right?»",https://www.tagesanzeiger.ch//digital-natives-greifen-nach-der-macht-670535407844
Swissmedic lässt ersten Omikron-Booster zu,https://www.tagesanzeiger.ch//digital-natives-greifen-nach-der-macht-670535407844
Ukraine startet Gegenoffensive im Süden | Neue Details aus Moskau zu Anschlag auf Darja Dugin,https://www.tagesanzeiger.ch//digital-natives-greifen-nach-der-macht-670535407844
Solaranlagen auf Neubauten sollen Pflicht werden,https://www.tagesanzeiger.ch//digital-natives-greifen-nach-der-macht-670535407844
«Jetzt sparen» – Zürichs Regierung appelliert an Bevölkerung,https://www.tagesanzeiger.ch//digital-natives-greifen-nach-der-macht-670535407844
"Arbeiten bis zum Umfallen? Nein, danke!",https://www.tagesanzeiger.ch//digital-natives-greifen-nach-der-macht-670535407844
