frontstory,url
Wie aus einer Ermittlung gegen einen Spionagering,https://www.tagesanzeiger.ch//wie-aus-einer-ermittlung-gegen-einen-spionagering-958934672176
"Wer sechs Monate kämpft, dem wird die Strafe erlassen",https://www.tagesanzeiger.ch//wie-aus-einer-ermittlung-gegen-einen-spionagering-958934672176
Wie die SVP die Energie­krise strategisch nutzt,https://www.tagesanzeiger.ch//wie-aus-einer-ermittlung-gegen-einen-spionagering-958934672176
Wie kalt darf es werden?,https://www.tagesanzeiger.ch//wie-aus-einer-ermittlung-gegen-einen-spionagering-958934672176
Wir atmen eiii-n. Und aus. Und eiii-n. Und aus…,https://www.tagesanzeiger.ch//wie-aus-einer-ermittlung-gegen-einen-spionagering-958934672176
Wenn das Essen unbezahlbar wird,https://www.tagesanzeiger.ch//wie-aus-einer-ermittlung-gegen-einen-spionagering-958934672176
