frontstory,url
Anwohner wehren sich gegen laute Poolpartys und aufheulende Ferraris,https://www.tagesanzeiger.ch//der-friesenberg-ist-nicht-dubai-508468118216
Wegen eines Milliardärs drohte Ueli Maurer dem obersten Finanz­kontrolleur ,https://www.tagesanzeiger.ch//der-friesenberg-ist-nicht-dubai-508468118216
Orlik sorgt für das erste Ausrufezeichen,https://www.tagesanzeiger.ch//der-friesenberg-ist-nicht-dubai-508468118216
AKW Saporischschja wieder am Netz – Situation laut Selenski weiterhin »sehr gefährlich«,https://www.tagesanzeiger.ch//der-friesenberg-ist-nicht-dubai-508468118216
"Stromkonzerne sollen auf Gewinne verzichten, um die Wirtschaft zu stützen",https://www.tagesanzeiger.ch//der-friesenberg-ist-nicht-dubai-508468118216
Wie aus einer Ermittlung gegen einen Spionagering,https://www.tagesanzeiger.ch//der-friesenberg-ist-nicht-dubai-508468118216
