frontstory,url
Nancy Pelosis Maschine in Taiwan gelandet,https://www.tagesanzeiger.ch//pelosi-soll-in-kuerze-in-taiwan-landen-437294141206
Schweiz liefert gesuchte Französin aus,https://www.tagesanzeiger.ch//pelosi-soll-in-kuerze-in-taiwan-landen-437294141206
"CIA spionierte in Kabul, Hellfire-Rakete traf Zawahri auf dem Balkon",https://www.tagesanzeiger.ch//pelosi-soll-in-kuerze-in-taiwan-landen-437294141206
Moskau stuft ukrainisches Asow-Regiment als «terroristisch» ein | London: Russische Flotte im Schwarzen Meer nach Angriff geschwächt ,https://www.tagesanzeiger.ch//pelosi-soll-in-kuerze-in-taiwan-landen-437294141206
Passagiere beissen sich nervös auf die Lippen – oben applaudiert der ganze Bus,https://www.tagesanzeiger.ch//pelosi-soll-in-kuerze-in-taiwan-landen-437294141206
Sie will ihren hirntoten Sohn nicht sterben lassen,https://www.tagesanzeiger.ch//pelosi-soll-in-kuerze-in-taiwan-landen-437294141206
