frontstory,url
Die Situation ist gefährlich wie nie,https://www.tagesanzeiger.ch//die-taiwan-frage-darf-nicht-zum-stellvertreterkrieg-fuehren-335902386145
Wirds mit Ueli Maurer besser? – «sicher nicht»,https://www.tagesanzeiger.ch//die-taiwan-frage-darf-nicht-zum-stellvertreterkrieg-fuehren-335902386145
Die neusten Zahlen zur Corona-Pandemie,https://www.tagesanzeiger.ch//die-taiwan-frage-darf-nicht-zum-stellvertreterkrieg-fuehren-335902386145
Ukrainischer Getreide-Frachter zur Inspektion in Türkei eingetroffen | USA mit neuen Sanktionen gegen Oligarchen,https://www.tagesanzeiger.ch//die-taiwan-frage-darf-nicht-zum-stellvertreterkrieg-fuehren-335902386145
"«Monströs, hässlich, unnötig» – zornige Reaktionen auf Uetlibergbahn-Projekt",https://www.tagesanzeiger.ch//die-taiwan-frage-darf-nicht-zum-stellvertreterkrieg-fuehren-335902386145
Sie will ihren hirntoten Sohn nicht sterben lassen,https://www.tagesanzeiger.ch//die-taiwan-frage-darf-nicht-zum-stellvertreterkrieg-fuehren-335902386145
