frontstory,url
"Schillernd, vorlaut, arrogant: Er ist die Hauptfigur im Schach-Krimi",https://www.tagesanzeiger.ch//schillernd-vorlaut-arrogant-er-ist-die-hauptfigur-im-schach-krimi-512587773845
Credit Suisse profitiert von der eigenen Krise,https://www.tagesanzeiger.ch//schillernd-vorlaut-arrogant-er-ist-die-hauptfigur-im-schach-krimi-512587773845
Eine klare Botschaft an die Autokraten im Osten Europas,https://www.tagesanzeiger.ch//schillernd-vorlaut-arrogant-er-ist-die-hauptfigur-im-schach-krimi-512587773845
Das Wichtigste in der Übersicht,https://www.tagesanzeiger.ch//schillernd-vorlaut-arrogant-er-ist-die-hauptfigur-im-schach-krimi-512587773845
Angebliche Mobilmachung in Moldau: Gefälschtes Video der Präsidentin verbreitet,https://www.tagesanzeiger.ch//schillernd-vorlaut-arrogant-er-ist-die-hauptfigur-im-schach-krimi-512587773845
Sie will den Männerclub sprengen,https://www.tagesanzeiger.ch//schillernd-vorlaut-arrogant-er-ist-die-hauptfigur-im-schach-krimi-512587773845
