frontstory,url
"«Es ist unglaublich, was wir als kleines ETH-Spinoff geschafft haben»",https://www.tagesanzeiger.ch//vertical-farming-landwirtschaft-im-regal-922318667247
Eine Witwe kämpft für die Wahrheit,https://www.tagesanzeiger.ch//vertical-farming-landwirtschaft-im-regal-922318667247
Wegen des Kriegs herrscht in der Garderobe eisernes Schweigen,https://www.tagesanzeiger.ch//vertical-farming-landwirtschaft-im-regal-922318667247
Im Niederdorf brannte eine Baustelle,https://www.tagesanzeiger.ch//vertical-farming-landwirtschaft-im-regal-922318667247
«Gegen soziale Panik ist niemand gefeit»,https://www.tagesanzeiger.ch//vertical-farming-landwirtschaft-im-regal-922318667247
«Diese Canepa-Aussage passt zu einem sehr kleinen Verein»,https://www.tagesanzeiger.ch//vertical-farming-landwirtschaft-im-regal-922318667247
