frontstory,url
"Der trotzige Glaube, am längeren Hebel zu sitzen",https://www.tagesanzeiger.ch//der-trotzige-glaube-am-laengeren-hebel-zu-sitzen-675203950906
«Die Rechenzentren könnten 200’000 Haushalte mit Strom versorgen»,https://www.tagesanzeiger.ch//der-trotzige-glaube-am-laengeren-hebel-zu-sitzen-675203950906
Stellenabbau bei Credit Suisse | Nominallöhne dürften um 2 Prozent steigen | XXXL kauft zu,https://www.tagesanzeiger.ch//der-trotzige-glaube-am-laengeren-hebel-zu-sitzen-675203950906
Lukoil-Chef stirbt nach rätselhaftem Sturz aus Krankenhausfenster,https://www.tagesanzeiger.ch//der-trotzige-glaube-am-laengeren-hebel-zu-sitzen-675203950906
Atomexperten im AKW eingetroffen | Ukraine greift im Süden offenbar mit Langstreckenraketen an ,https://www.tagesanzeiger.ch//der-trotzige-glaube-am-laengeren-hebel-zu-sitzen-675203950906
 Reicht eine A4-Seite als Lebensraum für ein Huhn? ,https://www.tagesanzeiger.ch//der-trotzige-glaube-am-laengeren-hebel-zu-sitzen-675203950906
