frontstory,url
"Sie wollen jeden ins Visier nehmen, der den Krieg unterstützt",https://www.tagesanzeiger.ch//sie-wollen-jeden-ins-visier-nehmen-der-den-krieg-unterstuetzt-128736692735
Die letzten Tage vor dem Fall des CS-Chefs,https://www.tagesanzeiger.ch//sie-wollen-jeden-ins-visier-nehmen-der-den-krieg-unterstuetzt-128736692735
"«Wenn der Winter sehr kalt wird, haben wir ein Problem»",https://www.tagesanzeiger.ch//sie-wollen-jeden-ins-visier-nehmen-der-den-krieg-unterstuetzt-128736692735
McConnell hat ein Problem mit Trumps Kandidaten,https://www.tagesanzeiger.ch//sie-wollen-jeden-ins-visier-nehmen-der-den-krieg-unterstuetzt-128736692735
Alain Berset wehrt sich erfolgreich gegen Handy-Antenne,https://www.tagesanzeiger.ch//sie-wollen-jeden-ins-visier-nehmen-der-den-krieg-unterstuetzt-128736692735
Geburtenrate ist in Zürich schlagartig um 20 Prozent gesunken,https://www.tagesanzeiger.ch//sie-wollen-jeden-ins-visier-nehmen-der-den-krieg-unterstuetzt-128736692735
