frontstory,url
«Wir müssen uns auf Wohlstandsverluste vorbereiten»,https://www.tagesanzeiger.ch//wir-muessen-uns-auf-wohlstandsverluste-vorbereiten-153584734856
Für die Ukraine verheisst der Anschlag nichts Gutes,https://www.tagesanzeiger.ch//wir-muessen-uns-auf-wohlstandsverluste-vorbereiten-153584734856
Am Beispiel Needle-Spiking: Wie kollektive Ängste entstehen,https://www.tagesanzeiger.ch//wir-muessen-uns-auf-wohlstandsverluste-vorbereiten-153584734856
Donald Trump klagt gegen FBI-Razzia,https://www.tagesanzeiger.ch//wir-muessen-uns-auf-wohlstandsverluste-vorbereiten-153584734856
Republikaner gefährden ihre guten Chancen,https://www.tagesanzeiger.ch//wir-muessen-uns-auf-wohlstandsverluste-vorbereiten-153584734856
Nun verschwindet die letzte englische Buchhandlung,https://www.tagesanzeiger.ch//wir-muessen-uns-auf-wohlstandsverluste-vorbereiten-153584734856
