frontstory,url
Mit ihr endet eine Ära in Grossbritannien,https://www.tagesanzeiger.ch//mit-ihr-endet-eine-aera-in-grossbritannien-330965223829
Ein solches Leben wird die Welt vermutlich nicht mehr sehen,https://www.tagesanzeiger.ch//mit-ihr-endet-eine-aera-in-grossbritannien-330965223829
Das Leben der Queen in Bildern,https://www.tagesanzeiger.ch//mit-ihr-endet-eine-aera-in-grossbritannien-330965223829
Oberster Auto-Lobbyist will Förderstopp für E-Autos,https://www.tagesanzeiger.ch//mit-ihr-endet-eine-aera-in-grossbritannien-330965223829
So läuft die Rückeroberung der Ukraine im Süden des Landes,https://www.tagesanzeiger.ch//mit-ihr-endet-eine-aera-in-grossbritannien-330965223829
Der Usain Bolt der Lüfte fesselt das Zürcher Publikum,https://www.tagesanzeiger.ch//mit-ihr-endet-eine-aera-in-grossbritannien-330965223829
