frontstory,url
"Fahren die Züge noch, wenn der Strom knapp wird?",https://www.tagesanzeiger.ch//fahren-die-zuege-noch-wenn-im-winter-der-strom-knapp-wird-711880589161
Die Ukraine demonstriert ein extremes Selbstbewusstsein,https://www.tagesanzeiger.ch//fahren-die-zuege-noch-wenn-im-winter-der-strom-knapp-wird-711880589161
Experten der IAEA unterwegs nach Saporischschja | Raketenangriffe auf Norden und Osten,https://www.tagesanzeiger.ch//fahren-die-zuege-noch-wenn-im-winter-der-strom-knapp-wird-711880589161
Bitcoin fällt unter 20'000 Dollar | Banking App bietet wieder Sparzinsen | EMS-Gewinn leicht höher,https://www.tagesanzeiger.ch//fahren-die-zuege-noch-wenn-im-winter-der-strom-knapp-wird-711880589161
"Linke wollen keine zweite Europaallee, SBB drohen mit Bauverzicht",https://www.tagesanzeiger.ch//fahren-die-zuege-noch-wenn-im-winter-der-strom-knapp-wird-711880589161
Kostspielige Niederlagen der Wettbewerbshüter ,https://www.tagesanzeiger.ch//fahren-die-zuege-noch-wenn-im-winter-der-strom-knapp-wird-711880589161
