frontstory,url
"«Wie sie aus dem Nichts kam, ist sehr amerikanisch. Ein Mythos»",https://www.tagesanzeiger.ch//wie-sie-aus-dem-nichts-kam-ist-sehr-amerikanisch-ein-mythos-437875715604
Führen die steigenden Zinsen zu einem Währungskrieg?,https://www.tagesanzeiger.ch//wie-sie-aus-dem-nichts-kam-ist-sehr-amerikanisch-ein-mythos-437875715604
Chile lehnt eine der progressivsten Verfassungen der Welt ab,https://www.tagesanzeiger.ch//wie-sie-aus-dem-nichts-kam-ist-sehr-amerikanisch-ein-mythos-437875715604
Kiew: Ort im Gebiet Cherson befreit | London: Russland konzentriert sich auf Ostukraine,https://www.tagesanzeiger.ch//wie-sie-aus-dem-nichts-kam-ist-sehr-amerikanisch-ein-mythos-437875715604
«Du weisst: Genau jetzt muss diese Milch fliessen»,https://www.tagesanzeiger.ch//wie-sie-aus-dem-nichts-kam-ist-sehr-amerikanisch-ein-mythos-437875715604
Bei Strassenlampen lässt sich überraschend viel Strom sparen,https://www.tagesanzeiger.ch//wie-sie-aus-dem-nichts-kam-ist-sehr-amerikanisch-ein-mythos-437875715604
