frontstory,url
«Es war Folter. Anders kann ich es nicht beschreiben»,https://www.tagesanzeiger.ch//es-war-folter-anders-kann-ich-es-nicht-beschreiben-307500060184
"Der Neue, die Elegante und der Knuddelbär",https://www.tagesanzeiger.ch//es-war-folter-anders-kann-ich-es-nicht-beschreiben-307500060184
Ganz Grossbritannien bangte um Archie,https://www.tagesanzeiger.ch//es-war-folter-anders-kann-ich-es-nicht-beschreiben-307500060184
Selenski lobt Erfolge der Armee – und westliche Waffen | Zweiter Getreidefrachter in Istanbul,https://www.tagesanzeiger.ch//es-war-folter-anders-kann-ich-es-nicht-beschreiben-307500060184
"China verschiebt die Grenzen langsam, aber beharrlich",https://www.tagesanzeiger.ch//es-war-folter-anders-kann-ich-es-nicht-beschreiben-307500060184
Sieben Mücken-Mythen im Check,https://www.tagesanzeiger.ch//es-war-folter-anders-kann-ich-es-nicht-beschreiben-307500060184
