frontstory,url
"«Wir sind nicht mehr bereit, Firmen in den Konkurs gehen zu lassen»",https://www.tagesanzeiger.ch//wir-sind-nicht-mehr-bereit-firmen-in-den-konkurs-gehen-zu-lassen-296303473031
Eine Explosion? Eine Demütigung,https://www.tagesanzeiger.ch//wir-sind-nicht-mehr-bereit-firmen-in-den-konkurs-gehen-zu-lassen-296303473031
«Bruder»? «Mörder»! In Belgrad tobt ein Kleinkrieg wegen eines Putin-Graffito,https://www.tagesanzeiger.ch//wir-sind-nicht-mehr-bereit-firmen-in-den-konkurs-gehen-zu-lassen-296303473031
Das Wichtigste in der Übersicht,https://www.tagesanzeiger.ch//wir-sind-nicht-mehr-bereit-firmen-in-den-konkurs-gehen-zu-lassen-296303473031
"Kerosin aus Sonnenschein, Luft und Wasser",https://www.tagesanzeiger.ch//wir-sind-nicht-mehr-bereit-firmen-in-den-konkurs-gehen-zu-lassen-296303473031
"«Herr Elsberg, wie sollen wir uns auf den Blackout vorbereiten?»",https://www.tagesanzeiger.ch//wir-sind-nicht-mehr-bereit-firmen-in-den-konkurs-gehen-zu-lassen-296303473031
