frontstory,url
Axpo handelt in grossem Stil mit Gas und Öl,https://www.tagesanzeiger.ch//axpo-handelt-in-grossem-stil-mit-gas-und-oel-189418412582
Die Schweiz darf auf einen warmen Winter hoffen,https://www.tagesanzeiger.ch//axpo-handelt-in-grossem-stil-mit-gas-und-oel-189418412582
Die Schweiz besiegt wieder einen Grossen des Weltfussballs,https://www.tagesanzeiger.ch//axpo-handelt-in-grossem-stil-mit-gas-und-oel-189418412582
Selenski ruft russische Kämpfer zum Aufgeben auf  Hunderte Festnahmen bei Anti-Kriegs-Protesten in Russland,https://www.tagesanzeiger.ch//axpo-handelt-in-grossem-stil-mit-gas-und-oel-189418412582
«Der ganze Abschied hätte nicht idealer sein können»,https://www.tagesanzeiger.ch//axpo-handelt-in-grossem-stil-mit-gas-und-oel-189418412582
Amerikaner werben mit Jagd-Safari in Zermatt,https://www.tagesanzeiger.ch//axpo-handelt-in-grossem-stil-mit-gas-und-oel-189418412582
