frontstory,url
Er stahl 60 Millionen und trieb die älteste Schweizer Privatbank in den Konkurs,https://www.tagesanzeiger.ch//er-stahl-60-millionen-und-trieb-die-aelteste-schweizer-privatbank-in-den-konkurs-454992355286
"Wer ist tatsächlich schuld, wenn Gas und Strom knapp werden?",https://www.tagesanzeiger.ch//er-stahl-60-millionen-und-trieb-die-aelteste-schweizer-privatbank-in-den-konkurs-454992355286
«Wir sind von der Evolution für den Strassenverkehr einfach nicht gemacht»,https://www.tagesanzeiger.ch//er-stahl-60-millionen-und-trieb-die-aelteste-schweizer-privatbank-in-den-konkurs-454992355286
Daniele Ganser führt zahlreiche Toppolitiker als «Partner»,https://www.tagesanzeiger.ch//er-stahl-60-millionen-und-trieb-die-aelteste-schweizer-privatbank-in-den-konkurs-454992355286
Die total authentische Zürich-Erfahrung – oder?,https://www.tagesanzeiger.ch//er-stahl-60-millionen-und-trieb-die-aelteste-schweizer-privatbank-in-den-konkurs-454992355286
Die Trockenheit zwingt Bauern zum Alpabzug,https://www.tagesanzeiger.ch//er-stahl-60-millionen-und-trieb-die-aelteste-schweizer-privatbank-in-den-konkurs-454992355286
