frontstory,url
Die Männer gaben den Ausschlag: Volk sagt hauchdünn Ja zur AHV-Reform,https://www.tagesanzeiger.ch//ahv-frauen-65-live-news-rente-abstimmung-resultate-598204916560
«Die Grossverteiler sollen ihre Margen auf Bioprodukten offenlegen»,https://www.tagesanzeiger.ch//ahv-frauen-65-live-news-rente-abstimmung-resultate-598204916560
Die Wirtschaft hat diese Niederlage verdient,https://www.tagesanzeiger.ch//ahv-frauen-65-live-news-rente-abstimmung-resultate-598204916560
So hat Ihre Gemeinde abgestimmt,https://www.tagesanzeiger.ch//ahv-frauen-65-live-news-rente-abstimmung-resultate-598204916560
So hat Zürich abgestimmt – die Übersicht,https://www.tagesanzeiger.ch//ahv-frauen-65-live-news-rente-abstimmung-resultate-598204916560
Überraschende Abfuhr für grosses SBB-Wohnprojekt mitten in Zürich,https://www.tagesanzeiger.ch//ahv-frauen-65-live-news-rente-abstimmung-resultate-598204916560
