frontstory,url
Mütter sind die wich­tigeren sport­lichen Vorbilder ,https://www.tagesanzeiger.ch//muetter-sind-die-wichtigeren-sportlichen-vorbilder-436296760643
Cassis’ Leute eröffnen ihr Trainingscamp im Sicherheitsrat,https://www.tagesanzeiger.ch//muetter-sind-die-wichtigeren-sportlichen-vorbilder-436296760643
Rechte Politiker laufen Sturm gegen «Staatszwang»,https://www.tagesanzeiger.ch//muetter-sind-die-wichtigeren-sportlichen-vorbilder-436296760643
London: Russland zieht U-Boote von Krim ab  Tote nach Beschuss in Donezk gemeldet,https://www.tagesanzeiger.ch//muetter-sind-die-wichtigeren-sportlichen-vorbilder-436296760643
"Minen, Lego und Wodka – auf dem Weg ins zurückeroberte Gebiet",https://www.tagesanzeiger.ch//muetter-sind-die-wichtigeren-sportlichen-vorbilder-436296760643
"«Die Frage ist, wie stellt die Frau ihren Körper zur Schau»",https://www.tagesanzeiger.ch//muetter-sind-die-wichtigeren-sportlichen-vorbilder-436296760643
