frontstory,url
Der Notfallplan für das grösste Solarkraftwerk kommt zu spät,https://www.tagesanzeiger.ch//der-notfallplan-fuer-das-groesste-solarkraftwerk-kommt-zu-spaet-657177745918
"Sie wollen jeden ins Visier nehmen, der den Krieg unterstützt",https://www.tagesanzeiger.ch//der-notfallplan-fuer-das-groesste-solarkraftwerk-kommt-zu-spaet-657177745918
Macron steht ein harter Winter bevor ,https://www.tagesanzeiger.ch//der-notfallplan-fuer-das-groesste-solarkraftwerk-kommt-zu-spaet-657177745918
Zu viele Überstunden: Polizeiwachen schliessen über Nacht,https://www.tagesanzeiger.ch//der-notfallplan-fuer-das-groesste-solarkraftwerk-kommt-zu-spaet-657177745918
Der Bestatter ermittelt wieder,https://www.tagesanzeiger.ch//der-notfallplan-fuer-das-groesste-solarkraftwerk-kommt-zu-spaet-657177745918
Er knallte mit dem Kopf ins Sägemehl und wusste: «Ich bin gelähmt»,https://www.tagesanzeiger.ch//der-notfallplan-fuer-das-groesste-solarkraftwerk-kommt-zu-spaet-657177745918
