frontstory,url
Zürcher Grüne planen Velodemo auf der Autobahn,https://www.tagesanzeiger.ch//zuercher-gruene-planen-velodemo-auf-der-autobahn-467137749803
China beginnt Militärmanöver nahe Taiwan  G7: Pelosis Besuch kein Grund für «aggressive Militäraktionen»,https://www.tagesanzeiger.ch//zuercher-gruene-planen-velodemo-auf-der-autobahn-467137749803
Nancy Pelosi und die Eskalation in Taiwan,https://www.tagesanzeiger.ch//zuercher-gruene-planen-velodemo-auf-der-autobahn-467137749803
Die Gräber wurden schon vor der Explosion ausgehoben,https://www.tagesanzeiger.ch//zuercher-gruene-planen-velodemo-auf-der-autobahn-467137749803
«Wir haben potenzielle Probleme mit der nuklearen Sicherheit»,https://www.tagesanzeiger.ch//zuercher-gruene-planen-velodemo-auf-der-autobahn-467137749803
Unter diesen Bedingungen möchten die Piloten nicht fliegen,https://www.tagesanzeiger.ch//zuercher-gruene-planen-velodemo-auf-der-autobahn-467137749803
