frontstory,url
«Unsere sexuelle Kultur macht Frauen unglücklich»,https://www.tagesanzeiger.ch//unsere-sexuelle-kultur-macht-frauen-ungluecklich-643695376712
Sie kamen in der Nacht,https://www.tagesanzeiger.ch//unsere-sexuelle-kultur-macht-frauen-ungluecklich-643695376712
Russland greift laut London jetzt Staudämme an  Selenski warnt vor Rekrutierung  Kreml beklagt «Hysterie»,https://www.tagesanzeiger.ch//unsere-sexuelle-kultur-macht-frauen-ungluecklich-643695376712
Was die Rechte mit Italien vorhat – und mit Europa,https://www.tagesanzeiger.ch//unsere-sexuelle-kultur-macht-frauen-ungluecklich-643695376712
"Er ist gestorben, damit wir Fussball schauen können",https://www.tagesanzeiger.ch//unsere-sexuelle-kultur-macht-frauen-ungluecklich-643695376712
Wie man dieses Land ertragen kann,https://www.tagesanzeiger.ch//unsere-sexuelle-kultur-macht-frauen-ungluecklich-643695376712
