frontstory,url
Ueli Maurer tritt Ende Jahr zurück,https://www.tagesanzeiger.ch//fragezeichen-um-bundesrat-ueli-maurer-741812695462
Ukrainische Stadt Liman kurz vor der Rückeroberung  Putin räumt Fehler bei Teilmobilmachung ein,https://www.tagesanzeiger.ch//fragezeichen-um-bundesrat-ueli-maurer-741812695462
EU: Energieunternehmen müssen übermässige Krisengewinne abgeben  Rekordwert: Inflation in Eurozone klettert auf 10 Prozent,https://www.tagesanzeiger.ch//fragezeichen-um-bundesrat-ueli-maurer-741812695462
Linke und Rechte verhindern gemeinsam Änderungen bei Sanktionen  Ergänzter Titel des Klimaschutzgesetzes sorgt bei der SVP für Ärger,https://www.tagesanzeiger.ch//fragezeichen-um-bundesrat-ueli-maurer-741812695462
«Es ist fast nichts übrig»,https://www.tagesanzeiger.ch//fragezeichen-um-bundesrat-ueli-maurer-741812695462
Das Ende einer Kultmarke – weil die Fifa immer mehr Geld wollte,https://www.tagesanzeiger.ch//fragezeichen-um-bundesrat-ueli-maurer-741812695462
