frontstory,url
Schwere Explosionen im Zentrum von Kiew  Explosion auf Krim-Brücke: Putin spricht von «Terrorakt»,https://www.tagesanzeiger.ch//ticker-ukraine-russland-krieg-wichtigste-news-18-230591284724
Meloni entdeckt den Teufel,https://www.tagesanzeiger.ch//ticker-ukraine-russland-krieg-wichtigste-news-18-230591284724
Bundesratswahl: Alle Augen richten sich nach Bern,https://www.tagesanzeiger.ch//ticker-ukraine-russland-krieg-wichtigste-news-18-230591284724
"«Niemand sagte: Mensch, so kann das nicht weitergehen»",https://www.tagesanzeiger.ch//ticker-ukraine-russland-krieg-wichtigste-news-18-230591284724
«Für den Kreml ist Bellingcat einer der beunruhigendsten Namen»,https://www.tagesanzeiger.ch//ticker-ukraine-russland-krieg-wichtigste-news-18-230591284724
"Sie tat alles, um Geflüchteten zu helfen",https://www.tagesanzeiger.ch//ticker-ukraine-russland-krieg-wichtigste-news-18-230591284724
