frontstory,url
"«Kein Wunder, bleiben haufenweise Koffer liegen»",https://www.tagesanzeiger.ch//kein-wunder-bleiben-haufenweise-koffer-liegen-131430481798
Zürich fordert «raschest­möglich» Affen­pocken-Impfung vom Bund ,https://www.tagesanzeiger.ch//kein-wunder-bleiben-haufenweise-koffer-liegen-131430481798
So läuft die Abkehr vom russischen Gas,https://www.tagesanzeiger.ch//kein-wunder-bleiben-haufenweise-koffer-liegen-131430481798
Schwarzmeerflotte laut London durch Explosionen auf Krim geschwächt | Russische Armee rückt im Donbass weiter vor,https://www.tagesanzeiger.ch//kein-wunder-bleiben-haufenweise-koffer-liegen-131430481798
Die Rabattliga geht auf Schnäppchenjagd,https://www.tagesanzeiger.ch//kein-wunder-bleiben-haufenweise-koffer-liegen-131430481798
Kongo bricht 500-Millionen-Deal – und bohrt nun im Regenwald,https://www.tagesanzeiger.ch//kein-wunder-bleiben-haufenweise-koffer-liegen-131430481798
