frontstory,url
Steckt Kiew hinter dem Mord an Darja Dugina?,https://www.tagesanzeiger.ch//steckt-kiew-hinter-dem-spektakulaeren-mord-an-darja-dugina-214546572995
Nun demonstrieren auch Schülerinnen,https://www.tagesanzeiger.ch//steckt-kiew-hinter-dem-spektakulaeren-mord-an-darja-dugina-214546572995
Günstigste Kasse im Kanton – der Prämien-Meister auf Mission,https://www.tagesanzeiger.ch//steckt-kiew-hinter-dem-spektakulaeren-mord-an-darja-dugina-214546572995
Kronfavorit für den Bundesrat: Was kann Albert Rösti jetzt noch stoppen?,https://www.tagesanzeiger.ch//steckt-kiew-hinter-dem-spektakulaeren-mord-an-darja-dugina-214546572995
Der Sieg kann so trostlos aussehen – Bilder der Zerstörung nach dem russischen Rückzug,https://www.tagesanzeiger.ch//steckt-kiew-hinter-dem-spektakulaeren-mord-an-darja-dugina-214546572995
Französische Autorin Annie Ernaux erhält den Literatur­preis,https://www.tagesanzeiger.ch//steckt-kiew-hinter-dem-spektakulaeren-mord-an-darja-dugina-214546572995
