frontstory,url
"«Geliebt werden zu wollen, ist eines der grössten Karrierehindernisse für Frauen»",https://www.tagesanzeiger.ch//geliebt-werden-zu-wollen-ist-eines-der-groessten-karrierehindernisse-fuer-frauen-445326856445
Wie ihr Vater unterstützte auch sie den Krieg gegen die Ukraine,https://www.tagesanzeiger.ch//geliebt-werden-zu-wollen-ist-eines-der-groessten-karrierehindernisse-fuer-frauen-445326856445
Ukraine rechnet mit verstärkten Angriffen | Russland meldet Abschuss von Drohnen über der Krim,https://www.tagesanzeiger.ch//geliebt-werden-zu-wollen-ist-eines-der-groessten-karrierehindernisse-fuer-frauen-445326856445
In der Schweiz soll es bald dunkel und kalt werden,https://www.tagesanzeiger.ch//geliebt-werden-zu-wollen-ist-eines-der-groessten-karrierehindernisse-fuer-frauen-445326856445
«Diese Kinder stehen unter Dauerstrom»,https://www.tagesanzeiger.ch//geliebt-werden-zu-wollen-ist-eines-der-groessten-karrierehindernisse-fuer-frauen-445326856445
"Sie tanzt, sie flirtet – und macht erfolgreich Politik",https://www.tagesanzeiger.ch//geliebt-werden-zu-wollen-ist-eines-der-groessten-karrierehindernisse-fuer-frauen-445326856445
