frontstory,url
Kommt es zur Überraschung beim Endlager-Entscheid?,https://www.tagesanzeiger.ch//kommt-es-zur-ueberraschung-beim-endlager-entscheid-177404965363
Die Amerikanerinnen stehen unter Strom,https://www.tagesanzeiger.ch//kommt-es-zur-ueberraschung-beim-endlager-entscheid-177404965363
Putin räumt sanktionsbedingte Wirtschaftsprobleme ein | Schweiz nimmt erste schwer kranke Ukrainer auf,https://www.tagesanzeiger.ch//kommt-es-zur-ueberraschung-beim-endlager-entscheid-177404965363
Ölpreise fallen auf mehrmonatige Tiefstände | Läderach wird Opfer von Cyber-Angriff,https://www.tagesanzeiger.ch//kommt-es-zur-ueberraschung-beim-endlager-entscheid-177404965363
So stark steigen die Strompreise in Ihrer Gemeinde,https://www.tagesanzeiger.ch//kommt-es-zur-ueberraschung-beim-endlager-entscheid-177404965363
Tim Cook stellt neue iPhones vor – und gleich mehrere Uhren,https://www.tagesanzeiger.ch//kommt-es-zur-ueberraschung-beim-endlager-entscheid-177404965363
