frontstory,url
Nach 54 Jahren wird das Drama der Piper Cherokee wieder lebendig,https://www.tagesanzeiger.ch//nach-54-jahren-wird-das-drama-der-piper-cherokee-wieder-lebendig-659656627613
"Britische Medien loben Rede des neuen Königs | «Danke, liebste Mama» – Charles III. wendet sich an die Nation ",https://www.tagesanzeiger.ch//nach-54-jahren-wird-das-drama-der-piper-cherokee-wieder-lebendig-659656627613
Langzeit-Königin Elizabeth II. wird nur von einem Monarchen übertrumpft,https://www.tagesanzeiger.ch//nach-54-jahren-wird-das-drama-der-piper-cherokee-wieder-lebendig-659656627613
London: Ukrainische Truppen stossen 50 Kilometer im Osten vor| Baerbock überrascht mit Besuch in Kiew,https://www.tagesanzeiger.ch//nach-54-jahren-wird-das-drama-der-piper-cherokee-wieder-lebendig-659656627613
Von der meistgehassten Frau des Landes zur Queen Consort,https://www.tagesanzeiger.ch//nach-54-jahren-wird-das-drama-der-piper-cherokee-wieder-lebendig-659656627613
«Die Linke schiesst sich ins eigene Bein. Dem Rassismus wird regelrecht zugedient»,https://www.tagesanzeiger.ch//nach-54-jahren-wird-das-drama-der-piper-cherokee-wieder-lebendig-659656627613
