frontstory,url
«Wie viel Platz wollen wir dieser Halligalli-Eventgastronomie geben?»,https://www.tagesanzeiger.ch//wie-viel-platz-wollen-wir-dieser-halligalli-eventgastronomie-geben-840854891518
London: Ukrainischer Vormarsch stellt Russland vor Nachschubprobleme  Moskau liefert wieder Gas nach Italien,https://www.tagesanzeiger.ch//wie-viel-platz-wollen-wir-dieser-halligalli-eventgastronomie-geben-840854891518
"Erst Putin, jetzt Kim: Da braut sich was zusammen",https://www.tagesanzeiger.ch//wie-viel-platz-wollen-wir-dieser-halligalli-eventgastronomie-geben-840854891518
Militärübung der USA und Südkorea missglückt – Rakete stürzt ab,https://www.tagesanzeiger.ch//wie-viel-platz-wollen-wir-dieser-halligalli-eventgastronomie-geben-840854891518
Carlsen-Bezwinger Niemann soll über 100-mal betrogen haben,https://www.tagesanzeiger.ch//wie-viel-platz-wollen-wir-dieser-halligalli-eventgastronomie-geben-840854891518
"«Teure Projekte, die als undurchführbar galten, sind nun plötzlich stark gefragt»",https://www.tagesanzeiger.ch//wie-viel-platz-wollen-wir-dieser-halligalli-eventgastronomie-geben-840854891518
