frontstory,url
Der grösste Geschlechter­graben der Geschichte,https://www.tagesanzeiger.ch//der-groesste-geschlechtergraben-aller-zeiten-820513605498
Wählt Italien heute die Rechten an die Macht?,https://www.tagesanzeiger.ch//der-groesste-geschlechtergraben-aller-zeiten-820513605498
Nun spannen Tierschutz und Bauernverband zusammen,https://www.tagesanzeiger.ch//der-groesste-geschlechtergraben-aller-zeiten-820513605498
So hat Ihre Gemeinde abgestimmt,https://www.tagesanzeiger.ch//der-groesste-geschlechtergraben-aller-zeiten-820513605498
Links-grüner Triumph auf Kosten von günstigen Wohnungen,https://www.tagesanzeiger.ch//der-groesste-geschlechtergraben-aller-zeiten-820513605498
Der günstigere Zmittag gewinnt,https://www.tagesanzeiger.ch//der-groesste-geschlechtergraben-aller-zeiten-820513605498
