frontstory,url
Jetzt marschieren sie in Richtung Cherson,https://www.tagesanzeiger.ch//jetzt-marschieren-sie-in-richtung-cherson-523422753937
Putin ernennt Tschetschenenführer Kadyrow zum Generaloberst  Russische Kriegsgegnerin flieht aus Hausarrest,https://www.tagesanzeiger.ch//jetzt-marschieren-sie-in-richtung-cherson-523422753937
"Ausgerechnet jetzt: Förderländer drehen den Ölhahn zu, Ölpreis steigt",https://www.tagesanzeiger.ch//jetzt-marschieren-sie-in-richtung-cherson-523422753937
Nawalnys Team kämpft im Untergrund für den Umsturz,https://www.tagesanzeiger.ch//jetzt-marschieren-sie-in-richtung-cherson-523422753937
Liz Truss verliert täglich an Statur,https://www.tagesanzeiger.ch//jetzt-marschieren-sie-in-richtung-cherson-523422753937
Wegen Zuschauerschwund: Auch Schweizer Theater locken mit Schleuderpreisen,https://www.tagesanzeiger.ch//jetzt-marschieren-sie-in-richtung-cherson-523422753937
