frontstory,url
Migros greift Nespresso mit «Kapselkaffee ohne Kapseln» an,https://www.tagesanzeiger.ch//migros-greift-nespresso-mit-kapselkaffee-ohne-kapseln-an-649408678932
Putins Eigentor,https://www.tagesanzeiger.ch//migros-greift-nespresso-mit-kapselkaffee-ohne-kapseln-an-649408678932
Der Rückzug der Credit Suisse aus den USA,https://www.tagesanzeiger.ch//migros-greift-nespresso-mit-kapselkaffee-ohne-kapseln-an-649408678932
Krebsvorsorge für Frauen ist hoffnungslos veraltet,https://www.tagesanzeiger.ch//migros-greift-nespresso-mit-kapselkaffee-ohne-kapseln-an-649408678932
"«Freunde sagen mir: ‹Zeki, du bist krank›»",https://www.tagesanzeiger.ch//migros-greift-nespresso-mit-kapselkaffee-ohne-kapseln-an-649408678932
Bencic sehnt sich nach dem Olympiafeeling,https://www.tagesanzeiger.ch//migros-greift-nespresso-mit-kapselkaffee-ohne-kapseln-an-649408678932
