frontstory,url
"«Ich bin für Putin kein Verräter, nur ein Feind»",https://www.tagesanzeiger.ch//ich-bin-fuer-putin-kein-verraeter-nur-ein-feind-137453418398
Putins Albtraum – Wie die Ukrainer mit der US-Superwaffe die Russen vertreiben,https://www.tagesanzeiger.ch//ich-bin-fuer-putin-kein-verraeter-nur-ein-feind-137453418398
Nach Millionenbusse: CS-Aktien im freien Fall,https://www.tagesanzeiger.ch//ich-bin-fuer-putin-kein-verraeter-nur-ein-feind-137453418398
US-Firma Biogen verkündet Durchbruch bei Alzheimer,https://www.tagesanzeiger.ch//ich-bin-fuer-putin-kein-verraeter-nur-ein-feind-137453418398
Den Porsche gibts zur Wohnung gratis dazu,https://www.tagesanzeiger.ch//ich-bin-fuer-putin-kein-verraeter-nur-ein-feind-137453418398
Wo es passt und wo es hakt – so bereit ist die Schweiz für die WM,https://www.tagesanzeiger.ch//ich-bin-fuer-putin-kein-verraeter-nur-ein-feind-137453418398
