frontstory,url
Gefangen in der Zusatzversicherung,https://www.tagesanzeiger.ch//gefangen-in-der-zusatzversicherung-891038779813
"Wer will, kann ab sofort nur noch 60 Prozent arbeiten",https://www.tagesanzeiger.ch//gefangen-in-der-zusatzversicherung-891038779813
Russischer Soldat gesteht Kriegsverbrechen in der Ukraine,https://www.tagesanzeiger.ch//gefangen-in-der-zusatzversicherung-891038779813
Selenski: «Russland bereitet massive Energie-Attacke vor» | Schwere Kämpfe in der Ukraine,https://www.tagesanzeiger.ch//gefangen-in-der-zusatzversicherung-891038779813
Früher war Mussolini das Vorbild – heute ist es Orban,https://www.tagesanzeiger.ch//gefangen-in-der-zusatzversicherung-891038779813
Keller schafft das Double – Schurter die Rekordmarke,https://www.tagesanzeiger.ch//gefangen-in-der-zusatzversicherung-891038779813
