frontstory,url
«Nochmals: Jede Kilowattstunde zählt»,https://www.tagesanzeiger.ch//nochmals-jede-kilowattstunde-zaehlt-180877611748
Billiger Nachtstrom wird zum Auslaufmodell,https://www.tagesanzeiger.ch//nochmals-jede-kilowattstunde-zaehlt-180877611748
Jetzt kommt die AKW-Initiative,https://www.tagesanzeiger.ch//nochmals-jede-kilowattstunde-zaehlt-180877611748
Wie in Zug die umstrittene Pipeline gesteuert wird,https://www.tagesanzeiger.ch//nochmals-jede-kilowattstunde-zaehlt-180877611748
Reichmuth und Wicki gewinnen – die Innerschweiz jubelt,https://www.tagesanzeiger.ch//nochmals-jede-kilowattstunde-zaehlt-180877611748
«Ja keine Frisur wie bei den Tschüttelern»,https://www.tagesanzeiger.ch//nochmals-jede-kilowattstunde-zaehlt-180877611748
