frontstory,url
«Ist der Fussball durch den VAR gerechter geworden? Ich sage: Nein!»,https://www.tagesanzeiger.ch//ist-der-fussball-durch-den-var-gerechter-geworden-ich-sage-nein-426496008705
Putin hat die Atombombe enttabuisiert,https://www.tagesanzeiger.ch//ist-der-fussball-durch-den-var-gerechter-geworden-ich-sage-nein-426496008705
"«Das hat uns gezeigt, dass wir selber gefährdet sind»",https://www.tagesanzeiger.ch//ist-der-fussball-durch-den-var-gerechter-geworden-ich-sage-nein-426496008705
Häuserpreise steigen trotz höherer Zinsen  Immer noch Kunden mit ungültigem Einzahlungsschein auf der Post,https://www.tagesanzeiger.ch//ist-der-fussball-durch-den-var-gerechter-geworden-ich-sage-nein-426496008705
Wie viele Schritte braucht es für ein gesünderes Leben?,https://www.tagesanzeiger.ch//ist-der-fussball-durch-den-var-gerechter-geworden-ich-sage-nein-426496008705
Schlottern bei 31 Grad,https://www.tagesanzeiger.ch//ist-der-fussball-durch-den-var-gerechter-geworden-ich-sage-nein-426496008705
