frontstory,url
Razzia bei Trump: «Die haben sogar meinen Safe geknackt!»,https://www.tagesanzeiger.ch//trump-sieht-sich-als-politisches-opfer-452359136106
Ein Toter bei Explosionen auf russischem Militärflugplatz auf der Krim | Russland installiert Flugabwehr um AKW,https://www.tagesanzeiger.ch//trump-sieht-sich-als-politisches-opfer-452359136106
Auch der Inselstaat probt den Ernstfall,https://www.tagesanzeiger.ch//trump-sieht-sich-als-politisches-opfer-452359136106
Zürcher Hetero-Paar darf Partnerschaft nicht eintragen lassen,https://www.tagesanzeiger.ch//trump-sieht-sich-als-politisches-opfer-452359136106
Serena Williams tritt bald zurück – unter «grossem Schmerz»,https://www.tagesanzeiger.ch//trump-sieht-sich-als-politisches-opfer-452359136106
Im Kanton Zürich fehlen nur noch 40 Lehrerinnen und Lehrer,https://www.tagesanzeiger.ch//trump-sieht-sich-als-politisches-opfer-452359136106
