frontstory,url
Lesbische Paare mit Kinderwunsch: Samenbanken müssen aufstocken ,https://www.tagesanzeiger.ch//lesbische-paare-mit-kinderwunsch-samenbanken-muessen-aufstocken-310022672920
Regionalzüge statt Milliarden für Schnellstrecken,https://www.tagesanzeiger.ch//lesbische-paare-mit-kinderwunsch-samenbanken-muessen-aufstocken-310022672920
China und die USA liefern sich einen kalten Krieg um Chips,https://www.tagesanzeiger.ch//lesbische-paare-mit-kinderwunsch-samenbanken-muessen-aufstocken-310022672920
Die Schlafwandler in Washington verschärfen den Konflikt mit China,https://www.tagesanzeiger.ch//lesbische-paare-mit-kinderwunsch-samenbanken-muessen-aufstocken-310022672920
"«Wenn die Löhne nicht erhöht werden, wird es soziale Unruhen geben»",https://www.tagesanzeiger.ch//lesbische-paare-mit-kinderwunsch-samenbanken-muessen-aufstocken-310022672920
Umweltfreundlicher Flug von Zürich nach New York kostet nur 36 Franken mehr,https://www.tagesanzeiger.ch//lesbische-paare-mit-kinderwunsch-samenbanken-muessen-aufstocken-310022672920
