frontstory,url
Sonderermittler stürzt sich auf Corona-Lecks,https://www.tagesanzeiger.ch//sonderermittler-stuerzt-sich-auf-corona-lecks-183164908405
Sexpause wegen Affenpocken,https://www.tagesanzeiger.ch//sonderermittler-stuerzt-sich-auf-corona-lecks-183164908405
Gefangen in der Zusatz­versicherung,https://www.tagesanzeiger.ch//sonderermittler-stuerzt-sich-auf-corona-lecks-183164908405
Selenski: «Russland bereitet massive Energie-Attacke vor» | Schwere Kämpfe in der Ukraine,https://www.tagesanzeiger.ch//sonderermittler-stuerzt-sich-auf-corona-lecks-183164908405
«Wir werden unser Land zurückholen»,https://www.tagesanzeiger.ch//sonderermittler-stuerzt-sich-auf-corona-lecks-183164908405
Die Brüste der Frau Odenthal,https://www.tagesanzeiger.ch//sonderermittler-stuerzt-sich-auf-corona-lecks-183164908405
