frontstory,url
Liz Truss will Boris Johnson rechts überholen,https://www.tagesanzeiger.ch//liz-truss-will-boris-johnson-rechts-ueberholen-143281932779
So versuchen Spitäler den Andrang in der Notaufnahme zu lindern,https://www.tagesanzeiger.ch//liz-truss-will-boris-johnson-rechts-ueberholen-143281932779
Führen die steigenden Zinsen zu einem Währungskrieg?,https://www.tagesanzeiger.ch//liz-truss-will-boris-johnson-rechts-ueberholen-143281932779
Russland will Referendum für Cherson stoppen | Moskau entzieht «Nowaja Gaseta» die Drucklizenz,https://www.tagesanzeiger.ch//liz-truss-will-boris-johnson-rechts-ueberholen-143281932779
"«Wie sie aus dem Nichts kam, ist sehr amerikanisch. Ein Mythos»",https://www.tagesanzeiger.ch//liz-truss-will-boris-johnson-rechts-ueberholen-143281932779
«Du weisst: Genau jetzt muss diese Milch fliessen»,https://www.tagesanzeiger.ch//liz-truss-will-boris-johnson-rechts-ueberholen-143281932779
