frontstory,url
Eine Explosion? Eine Demütigung,https://www.tagesanzeiger.ch//eine-explosion-eine-demuetigung-409840110892
Nestlé und das Wasser,https://www.tagesanzeiger.ch//eine-explosion-eine-demuetigung-409840110892
"«Herr Elsberg, wie sollen wir uns auf den Blackout vorbereiten?»",https://www.tagesanzeiger.ch//eine-explosion-eine-demuetigung-409840110892
E-Autos verlieren ihren Kostenvorteil,https://www.tagesanzeiger.ch//eine-explosion-eine-demuetigung-409840110892
Klima-Aktivisten blockieren die Hardbrücke,https://www.tagesanzeiger.ch//eine-explosion-eine-demuetigung-409840110892
"Sechs Ideen, um den Menschen bei steigenden Kosten zu helfen",https://www.tagesanzeiger.ch//eine-explosion-eine-demuetigung-409840110892
