frontstory,url
"Woodstock 1999, eine Katastrophe aus Gier und Inkompetenz",https://www.tagesanzeiger.ch//woodstock-1999-eine-katastrophe-aus-gier-und-inkompetenz-156476992678
"Warum es kaum etwas bringt, auch wenn es drei Tage regnet",https://www.tagesanzeiger.ch//woodstock-1999-eine-katastrophe-aus-gier-und-inkompetenz-156476992678
Gewitter über die Schweiz gezogen | Dreitägige Hitzewelle in Griechenland erwartet,https://www.tagesanzeiger.ch//woodstock-1999-eine-katastrophe-aus-gier-und-inkompetenz-156476992678
Wegen Strommangel: In China stehen die Fabriken still,https://www.tagesanzeiger.ch//woodstock-1999-eine-katastrophe-aus-gier-und-inkompetenz-156476992678
Moskau: «Keine schweren Waffen bei AKW Saporischschja» | Russland rekrutiert laut Bericht Gefangene,https://www.tagesanzeiger.ch//woodstock-1999-eine-katastrophe-aus-gier-und-inkompetenz-156476992678
"Zwillinge, zusammen seit 81 Jahren im Verkauf",https://www.tagesanzeiger.ch//woodstock-1999-eine-katastrophe-aus-gier-und-inkompetenz-156476992678
