frontstory,url
Es fühlt sich an wie der Abschied von einem Vertrauten,https://www.tagesanzeiger.ch//es-fuehlt-sich-an-wie-der-abschied-von-einem-vertrauten-127823619437
«Er wird diese Last für den Rest seines Lebens tragen»,https://www.tagesanzeiger.ch//es-fuehlt-sich-an-wie-der-abschied-von-einem-vertrauten-127823619437
Unsere besten Karikaturen mit Roger Federer,https://www.tagesanzeiger.ch//es-fuehlt-sich-an-wie-der-abschied-von-einem-vertrauten-127823619437
Moskau warnt USA vor Lieferung von Raketen mit grösseren Reichweiten | Washington stellt weitere 600 Millionen Dollar Militärhilfe bereit,https://www.tagesanzeiger.ch//es-fuehlt-sich-an-wie-der-abschied-von-einem-vertrauten-127823619437
Sie schleppen unser Gepäck – und manche geben nach wenigen Tagen auf,https://www.tagesanzeiger.ch//es-fuehlt-sich-an-wie-der-abschied-von-einem-vertrauten-127823619437
Laurent Eperon vom Baur au Lac kocht neu im Flugzeug,https://www.tagesanzeiger.ch//es-fuehlt-sich-an-wie-der-abschied-von-einem-vertrauten-127823619437
