frontstory,url
"Der Mäzen, der SVPler und der Baron bleiben in Lukaschenkos Diensten",https://www.tagesanzeiger.ch//der-maezen-der-svpler-und-der-baron-bleiben-in-lukaschenkos-diensten-584260259122
"Wie ich den Stromverbrauch halbiert habe, ohne zu leiden",https://www.tagesanzeiger.ch//der-maezen-der-svpler-und-der-baron-bleiben-in-lukaschenkos-diensten-584260259122
"Russland verbrennt seit Monaten Gas, während Europa darum bangt",https://www.tagesanzeiger.ch//der-maezen-der-svpler-und-der-baron-bleiben-in-lukaschenkos-diensten-584260259122
Frontex: Fast eine Million Einreisen aus Russland auf dem Landweg | AKW Saporischschja wieder am Netz,https://www.tagesanzeiger.ch//der-maezen-der-svpler-und-der-baron-bleiben-in-lukaschenkos-diensten-584260259122
Oberst Stefano Trojani erklärt der Schweiz den Ukraine-Krieg,https://www.tagesanzeiger.ch//der-maezen-der-svpler-und-der-baron-bleiben-in-lukaschenkos-diensten-584260259122
Sie knobelte sich bis ins grosse Finale,https://www.tagesanzeiger.ch//der-maezen-der-svpler-und-der-baron-bleiben-in-lukaschenkos-diensten-584260259122
