frontstory,url
Shane MacGowan gilt als uninterviewbar – wir haben es trotzdem gemacht,https://www.tagesanzeiger.ch//shane-macgowan-gilt-als-nicht-interviewbar-wir-haben-es-trotzdem-gemacht-834182462614
Swiss stellt im grossen Stil Crews aus dem Ausland an,https://www.tagesanzeiger.ch//shane-macgowan-gilt-als-nicht-interviewbar-wir-haben-es-trotzdem-gemacht-834182462614
Die Berner Reggaeband darf wieder nicht spielen,https://www.tagesanzeiger.ch//shane-macgowan-gilt-als-nicht-interviewbar-wir-haben-es-trotzdem-gemacht-834182462614
Weltweit blüht das Milliardengeschäft mit Killerdrohnen,https://www.tagesanzeiger.ch//shane-macgowan-gilt-als-nicht-interviewbar-wir-haben-es-trotzdem-gemacht-834182462614
Moskau wirft EU-Ländern «Nazi-Politik» vor | Kiewer Bürger besichtigen erbeutete Panzer,https://www.tagesanzeiger.ch//shane-macgowan-gilt-als-nicht-interviewbar-wir-haben-es-trotzdem-gemacht-834182462614
"Auf diese Frau hört der Bundesrat, wenn es ernst wird",https://www.tagesanzeiger.ch//shane-macgowan-gilt-als-nicht-interviewbar-wir-haben-es-trotzdem-gemacht-834182462614
