frontstory,url
Nur die Sparzinsen steigen noch nicht,https://www.tagesanzeiger.ch//nur-die-sparzinsen-steigen-noch-nicht-984249276473
Höchste Schweizer Richter informieren Bund falsch,https://www.tagesanzeiger.ch//nur-die-sparzinsen-steigen-noch-nicht-984249276473
"Russland rekrutiert in der Stube, am Arbeitsort oder grad von der Strasse weg",https://www.tagesanzeiger.ch//nur-die-sparzinsen-steigen-noch-nicht-984249276473
«Als wären wir der Kompost der Schweiz»,https://www.tagesanzeiger.ch//nur-die-sparzinsen-steigen-noch-nicht-984249276473
«Wir sagen einfach: Scheiss auf euch und eure Religion» ,https://www.tagesanzeiger.ch//nur-die-sparzinsen-steigen-noch-nicht-984249276473
"Das Tribunal endet, das Trauma bleibt",https://www.tagesanzeiger.ch//nur-die-sparzinsen-steigen-noch-nicht-984249276473
