frontstory,url
Jetzt setzt Putin alles auf eine Karte,https://www.tagesanzeiger.ch//jetzt-setzt-putin-alles-auf-eine-karte-777596648739
Nationalrat stimmt höheren Prämien­ver­billigungen und AHV-Teuerungs­ausgleich zu,https://www.tagesanzeiger.ch//jetzt-setzt-putin-alles-auf-eine-karte-777596648739
Doch noch zur Vernunft gekommen,https://www.tagesanzeiger.ch//jetzt-setzt-putin-alles-auf-eine-karte-777596648739
"Batterien von E-Autos können helfen, die Stromkrise zu meistern",https://www.tagesanzeiger.ch//jetzt-setzt-putin-alles-auf-eine-karte-777596648739
In diesen Bergregionen sterben die meisten Wanderer,https://www.tagesanzeiger.ch//jetzt-setzt-putin-alles-auf-eine-karte-777596648739
"Er half mit, die Fixer vom Letten zu holen",https://www.tagesanzeiger.ch//jetzt-setzt-putin-alles-auf-eine-karte-777596648739
