frontstory,url
Eltern und Schulleiter kontern Panikruf der Lehrerpräsidentin,https://www.tagesanzeiger.ch//eltern-und-schulleiter-kontern-panikruf-der-lehrerpraesidentin-823636178415
"«Es muss mehr passieren, um eine drohende Energiearmut zu vermeiden»",https://www.tagesanzeiger.ch//eltern-und-schulleiter-kontern-panikruf-der-lehrerpraesidentin-823636178415
Moskau greift Osten mit Raketen und Artillerie an | Tschetschenische Einheiten sollen Russland verstärken,https://www.tagesanzeiger.ch//eltern-und-schulleiter-kontern-panikruf-der-lehrerpraesidentin-823636178415
Erkennen Sie den Helvetismus? Teil 4,https://www.tagesanzeiger.ch//eltern-und-schulleiter-kontern-panikruf-der-lehrerpraesidentin-823636178415
Street Parade 2022: Die Bilder,https://www.tagesanzeiger.ch//eltern-und-schulleiter-kontern-panikruf-der-lehrerpraesidentin-823636178415
Die Nebenwirkungen der Millionenparty,https://www.tagesanzeiger.ch//eltern-und-schulleiter-kontern-panikruf-der-lehrerpraesidentin-823636178415
