frontstory,url
Wie Putin in der Ukraine «Fakten» schaffen will,https://www.tagesanzeiger.ch//wie-putin-in-der-ukraine-fakten-schaffen-will-414083300982
Der Irrsinn an den Achttausendern hat seinen Preis: Noch mehr Tote,https://www.tagesanzeiger.ch//wie-putin-in-der-ukraine-fakten-schaffen-will-414083300982
Linke lanciert Debatte über neuen Status für Kriegsflüchtlinge,https://www.tagesanzeiger.ch//wie-putin-in-der-ukraine-fakten-schaffen-will-414083300982
Zivile Opfer im Krieg: Tödliches Feuerwerk über der Ukraine,https://www.tagesanzeiger.ch//wie-putin-in-der-ukraine-fakten-schaffen-will-414083300982
«Wir sind ein Verein von elitären Menschen für elitäre Menschen? Völlig falsch!»,https://www.tagesanzeiger.ch//wie-putin-in-der-ukraine-fakten-schaffen-will-414083300982
Bekannte Kosovo-Albanerin in Wohnung tot aufgefunden,https://www.tagesanzeiger.ch//wie-putin-in-der-ukraine-fakten-schaffen-will-414083300982
