frontstory,url
Die Welt im Krisenmodus: Ständig tauchen neue Brandherde auf,https://www.tagesanzeiger.ch//die-welt-ist-im-krisenmodus-staendig-tauchen-neue-brandherde-auf-480753112782
Militärisches Desaster für Putin  Tschetschenenführer fordert Einsatz von «Atomwaffen mit geringer Sprengkraft»,https://www.tagesanzeiger.ch//die-welt-ist-im-krisenmodus-staendig-tauchen-neue-brandherde-auf-480753112782
Europa steht schutzlos da,https://www.tagesanzeiger.ch//die-welt-ist-im-krisenmodus-staendig-tauchen-neue-brandherde-auf-480753112782
1000 Menschen protestieren in Zürich gegen Iran-Regime,https://www.tagesanzeiger.ch//die-welt-ist-im-krisenmodus-staendig-tauchen-neue-brandherde-auf-480753112782
Er holt Rekord um Rekord – und sie nennen ihn dick,https://www.tagesanzeiger.ch//die-welt-ist-im-krisenmodus-staendig-tauchen-neue-brandherde-auf-480753112782
Xhaka trifft bei Arsenal-Sieg  Union und Dortmund verlieren,https://www.tagesanzeiger.ch//die-welt-ist-im-krisenmodus-staendig-tauchen-neue-brandherde-auf-480753112782
