frontstory,url
"Schweizer Premiere – arbeiten im Turm, der 200 Meter überragt",https://www.tagesanzeiger.ch//erster-einblick-so-sieht-es-im-neuen-hoechsten-hochhaus-der-schweiz-aus-431985921268
Joe Biden gibt den dunklen Ritter,https://www.tagesanzeiger.ch//erster-einblick-so-sieht-es-im-neuen-hoechsten-hochhaus-der-schweiz-aus-431985921268
Stimmt der Lohn noch?,https://www.tagesanzeiger.ch//erster-einblick-so-sieht-es-im-neuen-hoechsten-hochhaus-der-schweiz-aus-431985921268
Moskau lässt offenbar keine Journalisten ins AKW | Kiew fordert deutsche Kampfpanzer,https://www.tagesanzeiger.ch//erster-einblick-so-sieht-es-im-neuen-hoechsten-hochhaus-der-schweiz-aus-431985921268
Starke Frauen sagen Ja zu einem höheren Rentenalter,https://www.tagesanzeiger.ch//erster-einblick-so-sieht-es-im-neuen-hoechsten-hochhaus-der-schweiz-aus-431985921268
Fürstenhaus distanziert sich von angeblichem Verwandten,https://www.tagesanzeiger.ch//erster-einblick-so-sieht-es-im-neuen-hoechsten-hochhaus-der-schweiz-aus-431985921268
