frontstory,url
"Die lange Nacht der Tränen, des Dankes, des Abschiednehmens",https://www.tagesanzeiger.ch//wenn-sogar-nadal-endzeitstimmung-verbreitet-155887396817
Sie kamen in der Nacht,https://www.tagesanzeiger.ch//wenn-sogar-nadal-endzeitstimmung-verbreitet-155887396817
Selenski warnt vor Rekrutierung  Kreml beklagt «Hysterie»  Schweizer Botschafter berichtet von «barbarischem Besatzerregime»,https://www.tagesanzeiger.ch//wenn-sogar-nadal-endzeitstimmung-verbreitet-155887396817
Fürs Vaterland (aber nicht das eigene),https://www.tagesanzeiger.ch//wenn-sogar-nadal-endzeitstimmung-verbreitet-155887396817
Wie man dieses Land ertragen kann,https://www.tagesanzeiger.ch//wenn-sogar-nadal-endzeitstimmung-verbreitet-155887396817
Hände weg von den Naturjuwelen!,https://www.tagesanzeiger.ch//wenn-sogar-nadal-endzeitstimmung-verbreitet-155887396817
