frontstory,url
Swiss stellt im grossen Stil Crews aus dem Ausland an,https://www.tagesanzeiger.ch//swiss-stellt-im-grossen-stil-crews-aus-dem-ausland-an-581653515124
"Auf diese Frau hört der Bundesrat, wenn es ernst wird",https://www.tagesanzeiger.ch//swiss-stellt-im-grossen-stil-crews-aus-dem-ausland-an-581653515124
Der Westen wird kriegsmüde,https://www.tagesanzeiger.ch//swiss-stellt-im-grossen-stil-crews-aus-dem-ausland-an-581653515124
"«Wie dumm muss ein Volk sein, den Ast, auf dem es sitzt, abzusägen»",https://www.tagesanzeiger.ch//swiss-stellt-im-grossen-stil-crews-aus-dem-ausland-an-581653515124
Amina Rahimis Rettung vor den Fängen der Taliban,https://www.tagesanzeiger.ch//swiss-stellt-im-grossen-stil-crews-aus-dem-ausland-an-581653515124
«Touristin sein in der eigenen Stadt ist auch schön»,https://www.tagesanzeiger.ch//swiss-stellt-im-grossen-stil-crews-aus-dem-ausland-an-581653515124
