frontstory,url
Selbst im links-grünen Lager könnten Männer den Frauen im Weg stehen,https://www.tagesanzeiger.ch//46-koepfe-aber-nur-13-frauen-673727330845
"«Russland könnte versuchen, Kiew zu einer Kapitulation zu zwingen»",https://www.tagesanzeiger.ch//46-koepfe-aber-nur-13-frauen-673727330845
"Wenn Putin nicht einlenkt, wird das Getreide knapp",https://www.tagesanzeiger.ch//46-koepfe-aber-nur-13-frauen-673727330845
Gegenoffensive bereitet russischen Truppen enorme Probleme,https://www.tagesanzeiger.ch//46-koepfe-aber-nur-13-frauen-673727330845
«Musk hätte vor Gericht keine Chance gehabt»,https://www.tagesanzeiger.ch//46-koepfe-aber-nur-13-frauen-673727330845
"Als sie sich verletzte, schickte sie die Zwillingsschwester ins Rennen",https://www.tagesanzeiger.ch//46-koepfe-aber-nur-13-frauen-673727330845
