frontstory,url
Jetzt kommt die AKW-Initiative,https://www.tagesanzeiger.ch//jetzt-kommt-die-akw-initiative-948752554778
Billiger Nachtstrom wird zum Auslaufmodell,https://www.tagesanzeiger.ch//jetzt-kommt-die-akw-initiative-948752554778
Wie in Zug die umstrittene Pipeline gesteuert wird,https://www.tagesanzeiger.ch//jetzt-kommt-die-akw-initiative-948752554778
«Mein Volk wird vom Putin-Regime als Geisel gehalten»,https://www.tagesanzeiger.ch//jetzt-kommt-die-akw-initiative-948752554778
Die Berner stehen unter Druck – zieht Reichmuth durch?,https://www.tagesanzeiger.ch//jetzt-kommt-die-akw-initiative-948752554778
«Ja keine Frisur wie bei den Tschüttelern»,https://www.tagesanzeiger.ch//jetzt-kommt-die-akw-initiative-948752554778
