frontstory,url
Trump wird wegen Betrugs angeklagt,https://www.tagesanzeiger.ch//trump-wird-angeklagt-902956859676
Ukraine spottet über Mobilisierung von 300’000 Reservisten,https://www.tagesanzeiger.ch//trump-wird-angeklagt-902956859676
Wegen Teilmobilmachung: Ansturm in Russland auf Flüge ins Ausland  Cassis trifft Lawrow in New York,https://www.tagesanzeiger.ch//trump-wird-angeklagt-902956859676
Sass Adnan Syed 23 Jahre lang zu Unrecht im Gefängnis?,https://www.tagesanzeiger.ch//trump-wird-angeklagt-902956859676
Die Lichter bleiben an: Stadtrat krebst beim Stromsparen zurück,https://www.tagesanzeiger.ch//trump-wird-angeklagt-902956859676
Mit der Pension kommt die Krise – ein neuer Film befasst sich mit den «goldenen Jahren»,https://www.tagesanzeiger.ch//trump-wird-angeklagt-902956859676
