frontstory,url
"Wer ist tatsächlich schuld, wenn Gas und Strom knapp werden?",https://www.tagesanzeiger.ch//wer-ist-tatsaechlich-schuld-wenn-gas-und-strom-knapp-werden-804362267940
«Erstmals kann Kiew den Kriegsverlauf bestimmen»,https://www.tagesanzeiger.ch//wer-ist-tatsaechlich-schuld-wenn-gas-und-strom-knapp-werden-804362267940
Wie die Schweizer Staatskasse vom Ukraine-Krieg profitiert,https://www.tagesanzeiger.ch//wer-ist-tatsaechlich-schuld-wenn-gas-und-strom-knapp-werden-804362267940
Daniele Ganser führt zahlreiche Toppolitiker als «Partner»,https://www.tagesanzeiger.ch//wer-ist-tatsaechlich-schuld-wenn-gas-und-strom-knapp-werden-804362267940
Die total authentische Zürich-Erfahrung – oder?,https://www.tagesanzeiger.ch//wer-ist-tatsaechlich-schuld-wenn-gas-und-strom-knapp-werden-804362267940
Die Trockenheit zwingt Bauern zum Alpabzug,https://www.tagesanzeiger.ch//wer-ist-tatsaechlich-schuld-wenn-gas-und-strom-knapp-werden-804362267940
