frontstory,url
Karten zeigen den unglaublich schnellen Vorstoss der Ukrainer im Osten,https://www.tagesanzeiger.ch//der-ukraine-russland-konflikt-in-grafiken-890723979558
"Wer die Monarchie ablehnt, lebt in diesen Tagen gefährlich",https://www.tagesanzeiger.ch//der-ukraine-russland-konflikt-in-grafiken-890723979558
Die neusten Zahlen zur Corona-Pandemie,https://www.tagesanzeiger.ch//der-ukraine-russland-konflikt-in-grafiken-890723979558
Nationalrat sagt Ja zur Rettung der Stromkonzerne – SP wirft SVP Hetze gegen Sommaruga vor,https://www.tagesanzeiger.ch//der-ukraine-russland-konflikt-in-grafiken-890723979558
Wie eine junge Frau die alten Männer im Ständerat unter Druck setzt,https://www.tagesanzeiger.ch//der-ukraine-russland-konflikt-in-grafiken-890723979558
"Die Familie, die Oxycontin verbreitete – und sich jetzt aus der Verantwortung stiehlt",https://www.tagesanzeiger.ch//der-ukraine-russland-konflikt-in-grafiken-890723979558
