frontstory,url
«Der Bundesrat soll schon jetzt die Strom­mangel­lage ausrufen»,https://www.tagesanzeiger.ch//der-bundesrat-soll-jetzt-die-strommangellage-ausrufen-801877201163
"Sie verlangen offen, dass Putin geht",https://www.tagesanzeiger.ch//der-bundesrat-soll-jetzt-die-strommangellage-ausrufen-801877201163
Federers Millionen – auch da setzt er neue Massstäbe,https://www.tagesanzeiger.ch//der-bundesrat-soll-jetzt-die-strommangellage-ausrufen-801877201163
In den Bergen fällt der erste Schnee,https://www.tagesanzeiger.ch//der-bundesrat-soll-jetzt-die-strommangellage-ausrufen-801877201163
Mit Kleinkindern an Bord sind sie um die Welt gesegelt,https://www.tagesanzeiger.ch//der-bundesrat-soll-jetzt-die-strommangellage-ausrufen-801877201163
So gespalten sind die Republikaner,https://www.tagesanzeiger.ch//der-bundesrat-soll-jetzt-die-strommangellage-ausrufen-801877201163
