frontstory,url
Wie es um die Kriegskasse der Ukraine steht,https://www.tagesanzeiger.ch//wie-es-um-die-kriegskasse-der-ukraine-steht-787434736811
Russische Lokalpolitiker fordern Putins Rücktritt | China will mit Russland Welt in «gerechtere Richtung» führen,https://www.tagesanzeiger.ch//wie-es-um-die-kriegskasse-der-ukraine-steht-787434736811
"Immer weniger Putzkräfte, immer mehr Studierte",https://www.tagesanzeiger.ch//wie-es-um-die-kriegskasse-der-ukraine-steht-787434736811
"«Wir müssen verhindern, dass es einen verheerenden Flächenbrand gibt»",https://www.tagesanzeiger.ch//wie-es-um-die-kriegskasse-der-ukraine-steht-787434736811
Jean-Luc Godard ist tot ,https://www.tagesanzeiger.ch//wie-es-um-die-kriegskasse-der-ukraine-steht-787434736811
Armenien meldet Dutzende getötete Soldaten bei Kämpfen mit Aserbaidschan,https://www.tagesanzeiger.ch//wie-es-um-die-kriegskasse-der-ukraine-steht-787434736811
