frontstory,url
Gesprächsbereit? Biden und Putin senden vorsichtige Signale aus,https://www.tagesanzeiger.ch//gespraechsbereit-biden-und-putin-senden-vorsichtige-signale-aus-458578274199
Hat Elon Musk mit Putin gesprochen?,https://www.tagesanzeiger.ch//gespraechsbereit-biden-und-putin-senden-vorsichtige-signale-aus-458578274199
So wollen Schweizer Unternehmen im digitalen Universum Fuss fassen,https://www.tagesanzeiger.ch//gespraechsbereit-biden-und-putin-senden-vorsichtige-signale-aus-458578274199
In Zürich steigt das Risiko einer Immobilienblase,https://www.tagesanzeiger.ch//gespraechsbereit-biden-und-putin-senden-vorsichtige-signale-aus-458578274199
Auf der Suche nach Insekten oder Rehen fand er auch Skorpione,https://www.tagesanzeiger.ch//gespraechsbereit-biden-und-putin-senden-vorsichtige-signale-aus-458578274199
Britischer Geheimdienst­chef warnt Westen vor Chinas Einfluss,https://www.tagesanzeiger.ch//gespraechsbereit-biden-und-putin-senden-vorsichtige-signale-aus-458578274199
