frontstory,url
"Der Mann, den Trump loswerden will",https://www.tagesanzeiger.ch//der-mann-den-trump-loswerden-will-139421534655
Deutlich steigende Zahlen – was heisst das für den Corona-Herbst?,https://www.tagesanzeiger.ch//der-mann-den-trump-loswerden-will-139421534655
SVP sammelt Unterschriften gegen Gesetz über Klimaschutz-Ziele,https://www.tagesanzeiger.ch//der-mann-den-trump-loswerden-will-139421534655
Kreml offen für Gespräch zwischen Putin und Biden  Neue Angriffe auf ukrainische Städte,https://www.tagesanzeiger.ch//der-mann-den-trump-loswerden-will-139421534655
Russland feuert weiter: Wo die russischen Raketen einschlagen,https://www.tagesanzeiger.ch//der-mann-den-trump-loswerden-will-139421534655
Das Rätsel der schwarzen Pfosten,https://www.tagesanzeiger.ch//der-mann-den-trump-loswerden-will-139421534655
