frontstory,url
Die letzten Tage vor dem Fall des CS-Chefs,https://www.tagesanzeiger.ch//als-ich-mit-ihm-golfen-war-sah-er-wirklich-schlecht-aus-847947442682
"«Wenn der Winter sehr kalt wird, haben wir ein Problem»",https://www.tagesanzeiger.ch//als-ich-mit-ihm-golfen-war-sah-er-wirklich-schlecht-aus-847947442682
McConnell hat ein Problem mit Trumps Kandidaten,https://www.tagesanzeiger.ch//als-ich-mit-ihm-golfen-war-sah-er-wirklich-schlecht-aus-847947442682
Ukraine meldet mindestens 22 Tote nach russischem Raketentreffer auf Zug | Explosionen am Unabhängigkeitstag,https://www.tagesanzeiger.ch//als-ich-mit-ihm-golfen-war-sah-er-wirklich-schlecht-aus-847947442682
Alain Berset wehrt sich erfolgreich gegen Handy-Antenne,https://www.tagesanzeiger.ch//als-ich-mit-ihm-golfen-war-sah-er-wirklich-schlecht-aus-847947442682
Die verlorene Generation,https://www.tagesanzeiger.ch//als-ich-mit-ihm-golfen-war-sah-er-wirklich-schlecht-aus-847947442682
