frontstory,url
Geständnis eines Kriegsverbrechens,https://www.tagesanzeiger.ch//gestaendnis-eines-kriegsverbrechens-444171718483
Niemand will ein AKW bauen ,https://www.tagesanzeiger.ch//gestaendnis-eines-kriegsverbrechens-444171718483
Putins Eigentor,https://www.tagesanzeiger.ch//gestaendnis-eines-kriegsverbrechens-444171718483
Krebsvorsorge für Frauen ist hoffnungslos veraltet,https://www.tagesanzeiger.ch//gestaendnis-eines-kriegsverbrechens-444171718483
Migros greift Nespresso mit «Kapselkaffee ohne Kapseln» an,https://www.tagesanzeiger.ch//gestaendnis-eines-kriegsverbrechens-444171718483
Der Rückzug der Credit Suisse aus den USA,https://www.tagesanzeiger.ch//gestaendnis-eines-kriegsverbrechens-444171718483
