frontstory,url
"Sie wollen jeden ins Visier nehmen, der den Krieg unterst체tzt",https://www.tagesanzeiger.ch//sie-wollen-jeden-ins-visier-nehmen-der-den-krieg-unterstuetzt-128736692735
Die letzten Tage vor dem Fall des CS-Chefs,https://www.tagesanzeiger.ch//sie-wollen-jeden-ins-visier-nehmen-der-den-krieg-unterstuetzt-128736692735
Alain Berset wehrt sich erfolgreich gegen Handy-Antenne,https://www.tagesanzeiger.ch//sie-wollen-jeden-ins-visier-nehmen-der-den-krieg-unterstuetzt-128736692735
McConnell hat ein Problem mit Trumps Kandidaten,https://www.tagesanzeiger.ch//sie-wollen-jeden-ins-visier-nehmen-der-den-krieg-unterstuetzt-128736692735
Gnadenfrist f체r das Feuerwerk am Z체ri-F채scht,https://www.tagesanzeiger.ch//sie-wollen-jeden-ins-visier-nehmen-der-den-krieg-unterstuetzt-128736692735
Die Schweiz muss ganz genau hinschauen,https://www.tagesanzeiger.ch//sie-wollen-jeden-ins-visier-nehmen-der-den-krieg-unterstuetzt-128736692735
