frontstory,url
Das sind die grössten Stromfresser im Haushalt – und so sparen Sie Energie,https://www.tagesanzeiger.ch//das-sind-die-groessten-stromfresser-im-haushalt-und-so-sparen-sie-energie-915083383750
Ein milder Winter würde «sehr helfen»,https://www.tagesanzeiger.ch//das-sind-die-groessten-stromfresser-im-haushalt-und-so-sparen-sie-energie-915083383750
Warum diese Steinwüsten verschwinden sollen,https://www.tagesanzeiger.ch//das-sind-die-groessten-stromfresser-im-haushalt-und-so-sparen-sie-energie-915083383750
Ukraine startet Offensive bei Cherson – Moskau: Angriffs­versuche «kläglich gescheitert»,https://www.tagesanzeiger.ch//das-sind-die-groessten-stromfresser-im-haushalt-und-so-sparen-sie-energie-915083383750
"«Es ist unglaublich, was wir als kleines ETH-Spinoff geschafft haben»",https://www.tagesanzeiger.ch//das-sind-die-groessten-stromfresser-im-haushalt-und-so-sparen-sie-energie-915083383750
Grauenvoll – aber auf absolut fantastische Art ,https://www.tagesanzeiger.ch//das-sind-die-groessten-stromfresser-im-haushalt-und-so-sparen-sie-energie-915083383750
