frontstory,url
Pelosi gelandet  Demokratin erklärt umstrittenen Besuch  China droht mit «gezielten militärischen Aktionen»,https://www.tagesanzeiger.ch//pelosi-soll-in-kuerze-in-taiwan-landen-437294141206
Die neusten Zahlen zur Corona-Pandemie,https://www.tagesanzeiger.ch//pelosi-soll-in-kuerze-in-taiwan-landen-437294141206
Ganz Frankreich leidet offiziell unter Trockenheit | Bund warnt vor neuer markanter Hitzewelle,https://www.tagesanzeiger.ch//pelosi-soll-in-kuerze-in-taiwan-landen-437294141206
Erstes Schiff mit ukrainischem Getreide erreicht türkische Küste | «Desolater Zustand»: Spanien stoppt Lieferung von Leopard-Panzern,https://www.tagesanzeiger.ch//pelosi-soll-in-kuerze-in-taiwan-landen-437294141206
"«Monströs, hässlich, unnötig» – zornige Reaktionen auf Uetlibergbahn-Projekt",https://www.tagesanzeiger.ch//pelosi-soll-in-kuerze-in-taiwan-landen-437294141206
Passagiere beissen sich nervös auf die Lippen – oben applaudiert der ganze Bus,https://www.tagesanzeiger.ch//pelosi-soll-in-kuerze-in-taiwan-landen-437294141206
