frontstory,url
Grosser Sieg für die Regenwaldschützer,https://www.tagesanzeiger.ch//grosser-sieg-fuer-die-regenwaldschuetzer-953973730803
Chaos auf Schienen,https://www.tagesanzeiger.ch//grosser-sieg-fuer-die-regenwaldschuetzer-953973730803
US-Justizministerium hält Durch­suchungs­befehl unter Verschluss,https://www.tagesanzeiger.ch//grosser-sieg-fuer-die-regenwaldschuetzer-953973730803
Neue Explosion auf Krim – russisches Munitionslager detoniert | Laut Kiew Stützpunkt der Wagner-Gruppe zerstört,https://www.tagesanzeiger.ch//grosser-sieg-fuer-die-regenwaldschuetzer-953973730803
Angepeitscht vom härtesten Hund,https://www.tagesanzeiger.ch//grosser-sieg-fuer-die-regenwaldschuetzer-953973730803
Aus der Not gebar sie die Millionen-Idee,https://www.tagesanzeiger.ch//grosser-sieg-fuer-die-regenwaldschuetzer-953973730803
