frontstory,url
"«Es muss möglich sein, auch die Ukraine zu kritisieren»",https://www.tagesanzeiger.ch//auch-die-ukraine-muss-sich-kritik-gefallen-lassen-771057228106
Autor Salman Rushdie mit Stichwunde in Klinik eingeliefert,https://www.tagesanzeiger.ch//auch-die-ukraine-muss-sich-kritik-gefallen-lassen-771057228106
"Noch ein paar Zentimeter, dann geht auf dem Rhein fast nichts mehr",https://www.tagesanzeiger.ch//auch-die-ukraine-muss-sich-kritik-gefallen-lassen-771057228106
Wird sie die Erste sein?,https://www.tagesanzeiger.ch//auch-die-ukraine-muss-sich-kritik-gefallen-lassen-771057228106
Wohnungen gehen in der Schweiz deutlich schneller weg,https://www.tagesanzeiger.ch//auch-die-ukraine-muss-sich-kritik-gefallen-lassen-771057228106
Mit einem Schlag war der fröhliche Sport nur noch eine Randnotiz,https://www.tagesanzeiger.ch//auch-die-ukraine-muss-sich-kritik-gefallen-lassen-771057228106
