frontstory,url
«Dürfen uns von keinem Land mehr abhängig machen»,https://www.tagesanzeiger.ch//unsere-waffenlieferungen-schuetzen-leben-957081902257
Biden will eine geopolitische Wende ,https://www.tagesanzeiger.ch//unsere-waffenlieferungen-schuetzen-leben-957081902257
Putins Schlächter nehmen auch den Westen ins Visier,https://www.tagesanzeiger.ch//unsere-waffenlieferungen-schuetzen-leben-957081902257
Eindringling schnappt sich Swiss-Auto und fährt über die Landebahn,https://www.tagesanzeiger.ch//unsere-waffenlieferungen-schuetzen-leben-957081902257
"Ein Boom, eine grosse Figur – und jetzt Betrugsvorwürfe",https://www.tagesanzeiger.ch//unsere-waffenlieferungen-schuetzen-leben-957081902257
"Bin ich ansteckend, wenn der Selbsttest positiv ist?",https://www.tagesanzeiger.ch//unsere-waffenlieferungen-schuetzen-leben-957081902257
