frontstory,url
«80 Prozent sind weiblich und zwischen 25 und 40 Jahre alt»,https://www.tagesanzeiger.ch//80-prozent-sind-weiblich-und-zwischen-25-und-40-jahre-alt-733265898263
Gorbatschow und das Russland von heute,https://www.tagesanzeiger.ch//80-prozent-sind-weiblich-und-zwischen-25-und-40-jahre-alt-733265898263
"«Herzlich, bescheiden, geprägt von Vernunft»",https://www.tagesanzeiger.ch//80-prozent-sind-weiblich-und-zwischen-25-und-40-jahre-alt-733265898263
Kiew: Russland beschiesst während Anreise von IAEA-Team Stadt in AKW-Nähe | Ukrainer rücken laut Briten im Süden vor,https://www.tagesanzeiger.ch//80-prozent-sind-weiblich-und-zwischen-25-und-40-jahre-alt-733265898263
"Diese 8 Geräte helfen, den Energieverbrauch im Blick zu behalten",https://www.tagesanzeiger.ch//80-prozent-sind-weiblich-und-zwischen-25-und-40-jahre-alt-733265898263
Der Sommer 2022 ist ein Jahrhundertereignis,https://www.tagesanzeiger.ch//80-prozent-sind-weiblich-und-zwischen-25-und-40-jahre-alt-733265898263
