frontstory,url
Putins Propaganda-Pädagogen wollen nicht in der Ostukraine unterrichten,https://www.tagesanzeiger.ch//putins-propaganda-paedagogen-wollen-nicht-in-der-ostukraine-unterrichten-786993794507
"Luhansk, Donezk, Cherson und Saporischschja: Referenden über Annexion ab Freitag  Ukraine reagiert gelassen auf «Pseudoreferenden»",https://www.tagesanzeiger.ch//putins-propaganda-paedagogen-wollen-nicht-in-der-ostukraine-unterrichten-786993794507
Nach der Burka soll das nächste Kleidungsstück fallen,https://www.tagesanzeiger.ch//putins-propaganda-paedagogen-wollen-nicht-in-der-ostukraine-unterrichten-786993794507
Dritte-Säule-Fonds haben an Wert verloren,https://www.tagesanzeiger.ch//putins-propaganda-paedagogen-wollen-nicht-in-der-ostukraine-unterrichten-786993794507
Im nächsten Frühling heisst es: freie Fahrt nach Bern – wenn alles klappt,https://www.tagesanzeiger.ch//putins-propaganda-paedagogen-wollen-nicht-in-der-ostukraine-unterrichten-786993794507
Republikaner schicken Demokraten Migranten «vor die Haustür»,https://www.tagesanzeiger.ch//putins-propaganda-paedagogen-wollen-nicht-in-der-ostukraine-unterrichten-786993794507
