frontstory,url
"Jetzt jene nicht vergessen, die wegen des Lagers ihr Zuhause verlieren",https://www.tagesanzeiger.ch//jetzt-jene-nicht-vergessen-die-wegen-des-lagers-ihr-zuhause-verlieren-811073035182
Allein gegen den Rest der Schweiz ,https://www.tagesanzeiger.ch//jetzt-jene-nicht-vergessen-die-wegen-des-lagers-ihr-zuhause-verlieren-811073035182
Harte Kritik an den Gewinnen mit Krebsmedikamenten in der Schweiz,https://www.tagesanzeiger.ch//jetzt-jene-nicht-vergessen-die-wegen-des-lagers-ihr-zuhause-verlieren-811073035182
Steuern wir auf eine globale Rezession zu?,https://www.tagesanzeiger.ch//jetzt-jene-nicht-vergessen-die-wegen-des-lagers-ihr-zuhause-verlieren-811073035182
Stromausfall in weiten Teilen der Ostukraine nach Rückeroberung,https://www.tagesanzeiger.ch//jetzt-jene-nicht-vergessen-die-wegen-des-lagers-ihr-zuhause-verlieren-811073035182
Trauerprozession in Edinburgh | Abgeordneter: Zwei Millionen zur Totenwache in London erwartet,https://www.tagesanzeiger.ch//jetzt-jene-nicht-vergessen-die-wegen-des-lagers-ihr-zuhause-verlieren-811073035182
