frontstory,url
Bundesratswahl: Alle Augen richten sich nach Bern,https://www.tagesanzeiger.ch//bundesratswahl-alle-augen-richten-sich-nach-bern-590532815941
Eine Revolte im Kreml ist unwahrscheinlich – noch ,https://www.tagesanzeiger.ch//bundesratswahl-alle-augen-richten-sich-nach-bern-590532815941
Das beste Mittel gegen die Angst vor der Bombe,https://www.tagesanzeiger.ch//bundesratswahl-alle-augen-richten-sich-nach-bern-590532815941
Weil schenkt der Kanzlerpartei SPD einen Sieg,https://www.tagesanzeiger.ch//bundesratswahl-alle-augen-richten-sich-nach-bern-590532815941
"Sie tat alles, um Geflüchteten zu helfen",https://www.tagesanzeiger.ch//bundesratswahl-alle-augen-richten-sich-nach-bern-590532815941
"«Niemand sagte: Mensch, so kann das nicht weitergehen»",https://www.tagesanzeiger.ch//bundesratswahl-alle-augen-richten-sich-nach-bern-590532815941
