frontstory,url
"Immer weniger Putzkräfte, immer mehr Studierte",https://www.tagesanzeiger.ch//immer-weniger-putzkraefte-immer-mehr-studierte-575423380064
«Dieser Rettungsschirm ist nur ein weiteres trauriges Kapitel linker Energiepolitik»,https://www.tagesanzeiger.ch//immer-weniger-putzkraefte-immer-mehr-studierte-575423380064
Selenski: Ukraine hat 6000 Quadratkilometer befreit | China will mit Russland Welt in «gerechtere Richtung» führen,https://www.tagesanzeiger.ch//immer-weniger-putzkraefte-immer-mehr-studierte-575423380064
Armenien meldet Dutzende getötete Soldaten bei Kämpfen mit Aserbaidschan,https://www.tagesanzeiger.ch//immer-weniger-putzkraefte-immer-mehr-studierte-575423380064
"Sarah Akanji hört auf, weil sich die Angriffe auf ihre Person häufen",https://www.tagesanzeiger.ch//immer-weniger-putzkraefte-immer-mehr-studierte-575423380064
Für Meloni ist Deutschland das Problem – Konkurrent Letta ist für eine starke EU,https://www.tagesanzeiger.ch//immer-weniger-putzkraefte-immer-mehr-studierte-575423380064
