frontstory,url
So läuft die Abkehr vom russischen Gas,https://www.tagesanzeiger.ch//gas-aus-der-nordsee-und-aus-uebersee-hilft-speicher-zu-fuellen-970870365522
Nahm Donald Trump geheime Dokumente über Atomwaffen mit?,https://www.tagesanzeiger.ch//gas-aus-der-nordsee-und-aus-uebersee-hilft-speicher-zu-fuellen-970870365522
Joe Bidens Albtraum kehrt zurück,https://www.tagesanzeiger.ch//gas-aus-der-nordsee-und-aus-uebersee-hilft-speicher-zu-fuellen-970870365522
Russische Armee rückt im Donbass weiter vor | AKW vorläufig keine Bedrohung – Experten sollen Zugang erhalten,https://www.tagesanzeiger.ch//gas-aus-der-nordsee-und-aus-uebersee-hilft-speicher-zu-fuellen-970870365522
Sie stört die Party – und wird überall gefeiert,https://www.tagesanzeiger.ch//gas-aus-der-nordsee-und-aus-uebersee-hilft-speicher-zu-fuellen-970870365522
Noch nie staute sich der Verkehr vor dem Gotthard länger,https://www.tagesanzeiger.ch//gas-aus-der-nordsee-und-aus-uebersee-hilft-speicher-zu-fuellen-970870365522
