frontstory,url
Wie der Bundesrat die Schweizer Armee in die Unfähigkeit manövrierte,https://www.tagesanzeiger.ch//wie-der-bundesrat-die-schweizer-armee-in-die-unfaehigkeit-manoevrierte-634174491512
Fast zwei Drittel der Frauen sind gegen eine Erhöhung des Rentenalters,https://www.tagesanzeiger.ch//wie-der-bundesrat-die-schweizer-armee-in-die-unfaehigkeit-manoevrierte-634174491512
"Sollte der Markt weiter abschmieren, droht Peking die Totalkrise",https://www.tagesanzeiger.ch//wie-der-bundesrat-die-schweizer-armee-in-die-unfaehigkeit-manoevrierte-634174491512
Musks Hüst und Hott mit Tesla-Aktien,https://www.tagesanzeiger.ch//wie-der-bundesrat-die-schweizer-armee-in-die-unfaehigkeit-manoevrierte-634174491512
Was ist auf der russischen Luftwaffenbasis passiert?,https://www.tagesanzeiger.ch//wie-der-bundesrat-die-schweizer-armee-in-die-unfaehigkeit-manoevrierte-634174491512
«Dick wie ein Kinderarm» – Schlangen breiten sich in Zürcher Familiengärten aus,https://www.tagesanzeiger.ch//wie-der-bundesrat-die-schweizer-armee-in-die-unfaehigkeit-manoevrierte-634174491512
