frontstory,url
"Das Gepäck reist alleine, das Gesicht wird zum Ticket",https://www.tagesanzeiger.ch//das-gepaeck-reist-alleine-das-gesicht-wird-zum-ticket-524134987931
Republikaner gefährden ihre guten Chancen,https://www.tagesanzeiger.ch//das-gepaeck-reist-alleine-das-gesicht-wird-zum-ticket-524134987931
Post macht mehr Gewinn – und liefert weniger Pakete aus,https://www.tagesanzeiger.ch//das-gepaeck-reist-alleine-das-gesicht-wird-zum-ticket-524134987931
USA: Russland plant verstärkte Angriffe auf zivile Infrastruktur | Keller-Sutter: Geflüchtete aus der Ukraine sind gut integriert,https://www.tagesanzeiger.ch//das-gepaeck-reist-alleine-das-gesicht-wird-zum-ticket-524134987931
Wo 10-jährige Kinder 50 Meter weit fliegen,https://www.tagesanzeiger.ch//das-gepaeck-reist-alleine-das-gesicht-wird-zum-ticket-524134987931
Die asiatischen Reisegruppen sind nicht mehr gefragt,https://www.tagesanzeiger.ch//das-gepaeck-reist-alleine-das-gesicht-wird-zum-ticket-524134987931
