frontstory,url
Warum der Staat jetzt plötzlich Grosskonzernen helfen muss,https://www.tagesanzeiger.ch//warum-der-staat-jetzt-ploetzlich-grosskonzernen-helfen-muss-437000206261
Russland verdient mit Energie offenbar mehr als der Krieg kostet | Stromausfall nahe beim  AKW,https://www.tagesanzeiger.ch//warum-der-staat-jetzt-ploetzlich-grosskonzernen-helfen-muss-437000206261
Ist Kaffee ohne Kapselhülle wirklich ökologischer?,https://www.tagesanzeiger.ch//warum-der-staat-jetzt-ploetzlich-grosskonzernen-helfen-muss-437000206261
50 Elektroautos werden zum virtuellen Stausee,https://www.tagesanzeiger.ch//warum-der-staat-jetzt-ploetzlich-grosskonzernen-helfen-muss-437000206261
Schwedens Regierungschefin gratuliert der falschen Liz Truss,https://www.tagesanzeiger.ch//warum-der-staat-jetzt-ploetzlich-grosskonzernen-helfen-muss-437000206261
"Wer bei On arbeitet, soll Treppen steigen",https://www.tagesanzeiger.ch//warum-der-staat-jetzt-ploetzlich-grosskonzernen-helfen-muss-437000206261
