frontstory,url
Eine neue Stufe der Eskalation,https://www.tagesanzeiger.ch//eine-neue-stufe-der-eskalation-601005183116
Virales Video verifiziert: Junge Frau filmt Explosion neben Uni in Kiew,https://www.tagesanzeiger.ch//eine-neue-stufe-der-eskalation-601005183116
Bald steigen die Mieten,https://www.tagesanzeiger.ch//eine-neue-stufe-der-eskalation-601005183116
Russland wird in der Schweiz zu Milliarden-Zahlung verurteilt,https://www.tagesanzeiger.ch//eine-neue-stufe-der-eskalation-601005183116
So sieht ein Bundesrat aus,https://www.tagesanzeiger.ch//eine-neue-stufe-der-eskalation-601005183116
Neue Bündnisse setzen die Mullahs unter Druck,https://www.tagesanzeiger.ch//eine-neue-stufe-der-eskalation-601005183116
