frontstory,url
Nun will Deutschland Geld von der Schweiz ,https://www.tagesanzeiger.ch//nun-will-deutschland-geld-von-der-schweiz-703934362281
An manchen Orten sind die Russen sogar in Panik geflohen,https://www.tagesanzeiger.ch//nun-will-deutschland-geld-von-der-schweiz-703934362281
Nationalratskommission stimmt F-35-Beschaffung zu,https://www.tagesanzeiger.ch//nun-will-deutschland-geld-von-der-schweiz-703934362281
Zwei Tage vor Queen-Aufbahrung in London warten schon erste Trauernde | Tausende bei Trauerprozession mit Königsfamilie in Edinburgh,https://www.tagesanzeiger.ch//nun-will-deutschland-geld-von-der-schweiz-703934362281
Die Staatsgäste sollen mit Linienflugzeug und Bus anreisen,https://www.tagesanzeiger.ch//nun-will-deutschland-geld-von-der-schweiz-703934362281
«Der FCZ kann sich die Niederlagen auch schön reden»,https://www.tagesanzeiger.ch//nun-will-deutschland-geld-von-der-schweiz-703934362281
