frontstory,url
Biden und Macron wollen sich nicht in den Bus quetschen,https://www.tagesanzeiger.ch//biden-und-macron-wollen-sich-nicht-in-den-bus-quetschen-923592333411
Kiew schliesst Verhandlungen mit Putin zurzeit aus | Russischer Popstar kritisiert Krieg gegen die Ukraine scharf ,https://www.tagesanzeiger.ch//biden-und-macron-wollen-sich-nicht-in-den-bus-quetschen-923592333411
Der Applaus-Feminismus nützt sich ab,https://www.tagesanzeiger.ch//biden-und-macron-wollen-sich-nicht-in-den-bus-quetschen-923592333411
Erfolgreicher Schutz gegen Malaria,https://www.tagesanzeiger.ch//biden-und-macron-wollen-sich-nicht-in-den-bus-quetschen-923592333411
Leandra will Panzergrenadierin werden,https://www.tagesanzeiger.ch//biden-und-macron-wollen-sich-nicht-in-den-bus-quetschen-923592333411
"«Meine Aufgabe ist, die Leute von Netflix wegzubringen»",https://www.tagesanzeiger.ch//biden-und-macron-wollen-sich-nicht-in-den-bus-quetschen-923592333411
