frontstory,url
Aufregung in Russland: Auf einmal heisst es «Krieg»,https://www.tagesanzeiger.ch//jetzt-droht-der-kreml-den-eigenen-hardlinern-877036228808
Scholz versteckt sich hinter den USA,https://www.tagesanzeiger.ch//jetzt-droht-der-kreml-den-eigenen-hardlinern-877036228808
Sarg der Queen nach Trauerzug in der Westminster Hall aufgebahrt,https://www.tagesanzeiger.ch//jetzt-droht-der-kreml-den-eigenen-hardlinern-877036228808
Das Wichtigste in der Übersicht,https://www.tagesanzeiger.ch//jetzt-droht-der-kreml-den-eigenen-hardlinern-877036228808
Charles’ «verdammter» Fülli und die Erwartungen des Volkes,https://www.tagesanzeiger.ch//jetzt-droht-der-kreml-den-eigenen-hardlinern-877036228808
Vom Fischer zum Milliardär – jetzt zieht er in die Schweiz,https://www.tagesanzeiger.ch//jetzt-droht-der-kreml-den-eigenen-hardlinern-877036228808
