frontstory,url
Satellitenbilder zeigen das ganze Ausmass der Jahrhundertflut in Pakistan,https://www.tagesanzeiger.ch//satellitenbilder-zeigen-das-ganze-ausmass-der-jahrhundertflut-in-pakistan-387789173173
Aufsichts­instanz erteilt dem Bundes­rat einen Maul­korb,https://www.tagesanzeiger.ch//satellitenbilder-zeigen-das-ganze-ausmass-der-jahrhundertflut-in-pakistan-387789173173
Was über die Omikron-Impfstoffe bekannt ist,https://www.tagesanzeiger.ch//satellitenbilder-zeigen-das-ganze-ausmass-der-jahrhundertflut-in-pakistan-387789173173
Kiew beschiesst nach eigenen Angaben russische Basis nahe AKW | Am Samstag fliesst kein Gas über Nord Stream 1,https://www.tagesanzeiger.ch//satellitenbilder-zeigen-das-ganze-ausmass-der-jahrhundertflut-in-pakistan-387789173173
Nach den Übergriffen gab es ein Schoggitäfeli,https://www.tagesanzeiger.ch//satellitenbilder-zeigen-das-ganze-ausmass-der-jahrhundertflut-in-pakistan-387789173173
"«Glauben Sie mir, ich finde auch hier in die Erfolgsspur»",https://www.tagesanzeiger.ch//satellitenbilder-zeigen-das-ganze-ausmass-der-jahrhundertflut-in-pakistan-387789173173
