frontstory,url
Die Börsen boomen – und das ist kein gutes Zeichen,https://www.tagesanzeiger.ch//die-boersen-boomen-und-das-ist-kein-gutes-zeichen-644089159339
Neue Explosionen auf der Krim: Russland spricht von «Sabotage»,https://www.tagesanzeiger.ch//die-boersen-boomen-und-das-ist-kein-gutes-zeichen-644089159339
London: Russische Seemacht geschwächt | Finnland will Visa-Vergabe an Russen stark einschränken,https://www.tagesanzeiger.ch//die-boersen-boomen-und-das-ist-kein-gutes-zeichen-644089159339
CSS muss 129 Millionen Franken Prämien rück­er­statten | Weko leitet Unter­suchung gegen Pharma-Firma ein,https://www.tagesanzeiger.ch//die-boersen-boomen-und-das-ist-kein-gutes-zeichen-644089159339
Diese prominenten Politiker hoffen auf eine Ausnahme,https://www.tagesanzeiger.ch//die-boersen-boomen-und-das-ist-kein-gutes-zeichen-644089159339
Sechs Faktoren gefährden die Stromversorgung,https://www.tagesanzeiger.ch//die-boersen-boomen-und-das-ist-kein-gutes-zeichen-644089159339
