frontstory,url
Die Wut der Russen wächst,https://www.tagesanzeiger.ch//die-wut-der-russen-waechst-255768727252
Kann die Postfaschistin die Machtbalance in der EU verändern?,https://www.tagesanzeiger.ch//die-wut-der-russen-waechst-255768727252
Sollen Akademikerinnen länger arbeiten als Bauarbeiter?,https://www.tagesanzeiger.ch//die-wut-der-russen-waechst-255768727252
Drei Tote – auch Schweizer Touristen an Bord,https://www.tagesanzeiger.ch//die-wut-der-russen-waechst-255768727252
So leitet man einen Asteroiden um,https://www.tagesanzeiger.ch//die-wut-der-russen-waechst-255768727252
Die Stadt legt ihre Brunnen trocken,https://www.tagesanzeiger.ch//die-wut-der-russen-waechst-255768727252
