frontstory,url
"«Ich werde alles geben, damit wir wie ihr in der Schweiz leben können»",https://www.tagesanzeiger.ch//ich-werde-alles-geben-damit-wir-wie-ihr-in-der-schweiz-leben-koennen-836079801811
In Skandinavien herrscht Alarmstimmung,https://www.tagesanzeiger.ch//ich-werde-alles-geben-damit-wir-wie-ihr-in-der-schweiz-leben-koennen-836079801811
Putin kritisiert Fehler bei Mobilmachung  Umfrage: Fast jeder zweite Russe verspürt «Entsetzen»,https://www.tagesanzeiger.ch//ich-werde-alles-geben-damit-wir-wie-ihr-in-der-schweiz-leben-koennen-836079801811
«Bei dieser Hauruck-Gesetzgebung bleibt zu viel unklar»,https://www.tagesanzeiger.ch//ich-werde-alles-geben-damit-wir-wie-ihr-in-der-schweiz-leben-koennen-836079801811
"Die Mutter hat ihn jahrelang gepflegt, jetzt ermöglicht er ihr ein Herzensprojekt",https://www.tagesanzeiger.ch//ich-werde-alles-geben-damit-wir-wie-ihr-in-der-schweiz-leben-koennen-836079801811
Wie Tageslicht den Schlaf beeinflusst,https://www.tagesanzeiger.ch//ich-werde-alles-geben-damit-wir-wie-ihr-in-der-schweiz-leben-koennen-836079801811
