frontstory,url
"19-Grad-Grenze in der Wohnung soll für alle gelten
",https://www.tagesanzeiger.ch//verbaende-ruegen-bundesrat-und-fordern-maximal-19-grad-fuer-alle-689004304861
Viertes Leck in Nord-Stream-Pipelines entdeckt  Erdogan will mit Putin über Schein­referenden reden,https://www.tagesanzeiger.ch//verbaende-ruegen-bundesrat-und-fordern-maximal-19-grad-fuer-alle-689004304861
Alle gegen Silvia Steiner,https://www.tagesanzeiger.ch//verbaende-ruegen-bundesrat-und-fordern-maximal-19-grad-fuer-alle-689004304861
Werden die Proteste im Iran dem Regime gefährlich?,https://www.tagesanzeiger.ch//verbaende-ruegen-bundesrat-und-fordern-maximal-19-grad-fuer-alle-689004304861
Ukrainische Bürgerrechtlerin erhält alternativen Nobelpreis,https://www.tagesanzeiger.ch//verbaende-ruegen-bundesrat-und-fordern-maximal-19-grad-fuer-alle-689004304861
Missbräuchliche Nähe im Proberaum,https://www.tagesanzeiger.ch//verbaende-ruegen-bundesrat-und-fordern-maximal-19-grad-fuer-alle-689004304861
