frontstory,url
«Bei dieser Hauruck-Gesetzgebung bleibt zu viel unklar»,https://www.tagesanzeiger.ch//bei-dieser-hauruck-gesetzgebung-bleibt-zu-viel-unklar-516133140007
"«Ich werde alles geben, damit wir wie ihr in der Schweiz leben können»",https://www.tagesanzeiger.ch//bei-dieser-hauruck-gesetzgebung-bleibt-zu-viel-unklar-516133140007
In Skandinavien herrscht Alarmstimmung,https://www.tagesanzeiger.ch//bei-dieser-hauruck-gesetzgebung-bleibt-zu-viel-unklar-516133140007
Putin erkennt Gebiete als unabhängig an  Umfrage: Fast jeder zweite Russe verspürt «Entsetzen»,https://www.tagesanzeiger.ch//bei-dieser-hauruck-gesetzgebung-bleibt-zu-viel-unklar-516133140007
Wie Tageslicht den Schlaf beeinflusst,https://www.tagesanzeiger.ch//bei-dieser-hauruck-gesetzgebung-bleibt-zu-viel-unklar-516133140007
"Die Mutter hat ihn jahrelang gepflegt, jetzt ermöglicht er ihr ein Herzensprojekt",https://www.tagesanzeiger.ch//bei-dieser-hauruck-gesetzgebung-bleibt-zu-viel-unklar-516133140007
