frontstory,url
Erste Hochrechnung: Es wird ein spannendes Rennen beim Frauen-Rentenalter,https://www.tagesanzeiger.ch//ahv-frauen-65-live-news-rente-abstimmung-resultate-598204916560
Bei der Verrechnungssteuer ist noch alles offen,https://www.tagesanzeiger.ch//ahv-frauen-65-live-news-rente-abstimmung-resultate-598204916560
Klarer Nein-Trend zum Verbot der Massentierhaltung,https://www.tagesanzeiger.ch//ahv-frauen-65-live-news-rente-abstimmung-resultate-598204916560
AL-Initiative: Eine Überraschung liegt in der Luft,https://www.tagesanzeiger.ch//ahv-frauen-65-live-news-rente-abstimmung-resultate-598204916560
So stimmt Zürich ab – die Übersicht,https://www.tagesanzeiger.ch//ahv-frauen-65-live-news-rente-abstimmung-resultate-598204916560
Axpo handelt in grossem Stil mit Gas und Öl,https://www.tagesanzeiger.ch//ahv-frauen-65-live-news-rente-abstimmung-resultate-598204916560
