frontstory,url
Die total authentische Zürich-Erfahrung – oder?,https://www.tagesanzeiger.ch//die-total-authentische-zuerich-erfahrung-oder-469158948274
«Erstmals kann Kiew den Kriegsverlauf bestimmen»,https://www.tagesanzeiger.ch//die-total-authentische-zuerich-erfahrung-oder-469158948274
Wie die Schweizer Staatskasse vom Ukraine-Krieg profitiert,https://www.tagesanzeiger.ch//die-total-authentische-zuerich-erfahrung-oder-469158948274
Daniele Ganser führt zahlreiche Toppolitiker als «Partner»,https://www.tagesanzeiger.ch//die-total-authentische-zuerich-erfahrung-oder-469158948274
"Vom Food-Truck-Park zum Touri-Magnet: «Ziel war nie, einen Insider-Ort zu schaffen»",https://www.tagesanzeiger.ch//die-total-authentische-zuerich-erfahrung-oder-469158948274
Mehr als 15'000 Blitze zucken über der Schweiz | Gewitter bringen in kurzer Zeit viel Wasser und Hagel,https://www.tagesanzeiger.ch//die-total-authentische-zuerich-erfahrung-oder-469158948274
