frontstory,url
In diesen Bergregionen sterben die meisten Wanderer,https://www.tagesanzeiger.ch//in-diesen-bergregionen-sterben-die-meisten-wanderer-553405772203
"
National- und Ständerat sind auf Kollisionskurs",https://www.tagesanzeiger.ch//in-diesen-bergregionen-sterben-die-meisten-wanderer-553405772203
Der Streit um die Verrechnungssteuer,https://www.tagesanzeiger.ch//in-diesen-bergregionen-sterben-die-meisten-wanderer-553405772203
Die ukrainische Armee kommt nur langsam voran,https://www.tagesanzeiger.ch//in-diesen-bergregionen-sterben-die-meisten-wanderer-553405772203
"«Mirka genoss es nicht mehr, mir zuzuschauen»",https://www.tagesanzeiger.ch//in-diesen-bergregionen-sterben-die-meisten-wanderer-553405772203
Seine Branche könnte den halben Kanton Zürich mit Notstrom versorgen,https://www.tagesanzeiger.ch//in-diesen-bergregionen-sterben-die-meisten-wanderer-553405772203
