frontstory,url
Albert Rösti kann sich nur noch selbst schlagen,https://www.tagesanzeiger.ch//albert-roesti-kann-sich-nur-noch-selbst-schlagen-273036606933
Mit Frauenpower gegen Albert Rösti ,https://www.tagesanzeiger.ch//albert-roesti-kann-sich-nur-noch-selbst-schlagen-273036606933
"Er braute in der Küche literweise 
ein «Krebsmedikament» zusammen",https://www.tagesanzeiger.ch//albert-roesti-kann-sich-nur-noch-selbst-schlagen-273036606933
Studie sieht bis 2040 «gnadenlose Zuspitzung»,https://www.tagesanzeiger.ch//albert-roesti-kann-sich-nur-noch-selbst-schlagen-273036606933
"«Wenn es so weitergeht, wird Putin innert eines Jahres stürzen»",https://www.tagesanzeiger.ch//albert-roesti-kann-sich-nur-noch-selbst-schlagen-273036606933
Die Stimmung der CS-Mitarbeitenden schwankt zwischen Zorn und Stolz,https://www.tagesanzeiger.ch//albert-roesti-kann-sich-nur-noch-selbst-schlagen-273036606933
