frontstory,url
Nach den Übergriffen gab es ein Schoggitäfeli,https://www.tagesanzeiger.ch//nach-den-uebergriffen-gab-es-ein-schoggitaefeli-628677721899
«Die Preise an den Strombörsen haben jeden Bezug zur Realität verloren»,https://www.tagesanzeiger.ch//nach-den-uebergriffen-gab-es-ein-schoggitaefeli-628677721899
Nun decken sich Familien mit Survival-Produkten ein,https://www.tagesanzeiger.ch//nach-den-uebergriffen-gab-es-ein-schoggitaefeli-628677721899
Amt nimmt Baerbock gegen Shitstorm in Schutz,https://www.tagesanzeiger.ch//nach-den-uebergriffen-gab-es-ein-schoggitaefeli-628677721899
Satellitenbilder zeigen das ganze Ausmass der Jahrhundertflut in Pakistan,https://www.tagesanzeiger.ch//nach-den-uebergriffen-gab-es-ein-schoggitaefeli-628677721899
«Wir werden uns auf Hochhäuser einlassen müssen»,https://www.tagesanzeiger.ch//nach-den-uebergriffen-gab-es-ein-schoggitaefeli-628677721899
