frontstory,url
Diese einfachen Rezepte helfen gegen eine heisse Stadt,https://www.tagesanzeiger.ch//diese-einfachen-rezepte-helfen-gegen-eine-heisse-stadt-139815893599
Die Situation ist gef채hrlich wie nie,https://www.tagesanzeiger.ch//diese-einfachen-rezepte-helfen-gegen-eine-heisse-stadt-139815893599
London: Ukrainische Angriffe setzen russischem Milit채r zu | Wohnort Schweiz: US-Sanktionen gegen mutmassliche Putin-Geliebte,https://www.tagesanzeiger.ch//diese-einfachen-rezepte-helfen-gegen-eine-heisse-stadt-139815893599
Die n채chste Teuerungswelle rollt an,https://www.tagesanzeiger.ch//diese-einfachen-rezepte-helfen-gegen-eine-heisse-stadt-139815893599
Impressionen aus dem Bula,https://www.tagesanzeiger.ch//diese-einfachen-rezepte-helfen-gegen-eine-heisse-stadt-139815893599
Kansas stimmt f체r Recht auf Abtreibung,https://www.tagesanzeiger.ch//diese-einfachen-rezepte-helfen-gegen-eine-heisse-stadt-139815893599
