frontstory,url
Ständeräte verschleppen Rentenlösung für Frauen ,https://www.tagesanzeiger.ch//staenderaete-verschleppen-rentenloesung-fuer-frauen-587653831794
Was bei der Axpo schiefgelaufen ist,https://www.tagesanzeiger.ch//staenderaete-verschleppen-rentenloesung-fuer-frauen-587653831794
Deutschland tappt in Putins Falle,https://www.tagesanzeiger.ch//staenderaete-verschleppen-rentenloesung-fuer-frauen-587653831794
AKW-Betreiber wirft Besatzern Folter und Tötung von Mitarbeitern vor | Kiew gibt offiziell Raketenschläge auf die Krim zu,https://www.tagesanzeiger.ch//staenderaete-verschleppen-rentenloesung-fuer-frauen-587653831794
7 Highlights – und 4 Enttäuschungen,https://www.tagesanzeiger.ch//staenderaete-verschleppen-rentenloesung-fuer-frauen-587653831794
Liz Truss greift nach dem eisernen Besen,https://www.tagesanzeiger.ch//staenderaete-verschleppen-rentenloesung-fuer-frauen-587653831794
