frontstory,url
Russischer Soldat gesteht Kriegsverbrechen in der Ukraine,https://www.tagesanzeiger.ch//gestaendnis-eines-kriegsverbrechens-444171718483
Putins Eigentor,https://www.tagesanzeiger.ch//gestaendnis-eines-kriegsverbrechens-444171718483
Pensionskassen und Staat machen mit Stromnetzgebühren Kasse,https://www.tagesanzeiger.ch//gestaendnis-eines-kriegsverbrechens-444171718483
Krebsvorsorge für Frauen ist hoffnungslos veraltet,https://www.tagesanzeiger.ch//gestaendnis-eines-kriegsverbrechens-444171718483
Verstörende Bilder aus der Migros-Geflügelzucht ,https://www.tagesanzeiger.ch//gestaendnis-eines-kriegsverbrechens-444171718483
Putins Tochter landete mehrmals in Zürich,https://www.tagesanzeiger.ch//gestaendnis-eines-kriegsverbrechens-444171718483
