frontstory,url
Sein Hof wird bombardiert – doch das ist noch das kleinste Problem,https://www.tagesanzeiger.ch//kein-schiff-wird-kommen-869830589596
"Hypotheken werden wieder deutlich billiger, aber es gibt Ausnahmen",https://www.tagesanzeiger.ch//kein-schiff-wird-kommen-869830589596
Indien schlägt China mit seinen eigenen Waffen,https://www.tagesanzeiger.ch//kein-schiff-wird-kommen-869830589596
"Warum es kaum etwas bringt, auch wenn es drei Tage regnet",https://www.tagesanzeiger.ch//kein-schiff-wird-kommen-869830589596
"Wohnprojekt in Zürich: Wer aufs Auto verzichtet, darf länger Netflix schauen",https://www.tagesanzeiger.ch//kein-schiff-wird-kommen-869830589596
Der Überschallflug kommt zurück,https://www.tagesanzeiger.ch//kein-schiff-wird-kommen-869830589596
