frontstory,url
Erste Hochrechnung: Es wird ein knappes Rennen beim Frauen-Rentenalter,https://www.tagesanzeiger.ch//ahv-frauen-65-live-news-rente-abstimmung-resultate-598204916560
Schafft die Schweiz die Verrechnungssteuer ab?,https://www.tagesanzeiger.ch//ahv-frauen-65-live-news-rente-abstimmung-resultate-598204916560
Nein-Trend zur Massentierhaltungsinitiative,https://www.tagesanzeiger.ch//ahv-frauen-65-live-news-rente-abstimmung-resultate-598204916560
So stimmt Zürich ab – die Übersicht,https://www.tagesanzeiger.ch//ahv-frauen-65-live-news-rente-abstimmung-resultate-598204916560
Axpo handelt in grossem Stil mit Gas und Öl,https://www.tagesanzeiger.ch//ahv-frauen-65-live-news-rente-abstimmung-resultate-598204916560
Die Schweiz darf auf einen warmen Winter hoffen,https://www.tagesanzeiger.ch//ahv-frauen-65-live-news-rente-abstimmung-resultate-598204916560
