frontstory,url
Der Rezo der Schweiz,https://www.tagesanzeiger.ch//der-rezo-der-schweiz-126220485008
Der dreckigste Fluss Europas,https://www.tagesanzeiger.ch//der-rezo-der-schweiz-126220485008
Wie der Finanzjongleur Dieter Behring meinen Vater betrog,https://www.tagesanzeiger.ch//der-rezo-der-schweiz-126220485008
AKW ist wieder am Stromnetz | Biden warnt Moskau vor Einsatz nuklearer Waffen,https://www.tagesanzeiger.ch//der-rezo-der-schweiz-126220485008
Acht Enkelinnen und Enkel der Queen halten Totenwache an ihrem Sarg | König Charles überrascht die Wartenden,https://www.tagesanzeiger.ch//der-rezo-der-schweiz-126220485008
«Am meisten Sorgen bereitet mir das neue Telefonspiel»,https://www.tagesanzeiger.ch//der-rezo-der-schweiz-126220485008
