frontstory,url
«Wir rennen nicht wegen jedem Furz zum Arzt»,https://www.tagesanzeiger.ch//wir-rennen-nicht-wegen-jedem-furz-zum-arzt-699041122660
«Man muss mit Kriegsverbrechern verhandeln»,https://www.tagesanzeiger.ch//wir-rennen-nicht-wegen-jedem-furz-zum-arzt-699041122660
"Das Modernste, was die Rüstungs­industrie zu bieten hat",https://www.tagesanzeiger.ch//wir-rennen-nicht-wegen-jedem-furz-zum-arzt-699041122660
Zweites Massengrab in Liman entdeckt  Biden: Putin hat sich «erheblich verkalkuliert» ,https://www.tagesanzeiger.ch//wir-rennen-nicht-wegen-jedem-furz-zum-arzt-699041122660
Bekannter Zürcher Tüftler vor dem Ruin,https://www.tagesanzeiger.ch//wir-rennen-nicht-wegen-jedem-furz-zum-arzt-699041122660
Die Bevölkerung reagiert genervt auf den Treibstoffmangel,https://www.tagesanzeiger.ch//wir-rennen-nicht-wegen-jedem-furz-zum-arzt-699041122660
