frontstory,url
Whirlpool-Besitzer müssen im Winter durchheizen,https://www.tagesanzeiger.ch//whirlpool-besitzer-wollen-strom-sparen-muessen-aber-durchheizen-752943158085
Überraschend sinkt die Inflation in der Schweiz,https://www.tagesanzeiger.ch//whirlpool-besitzer-wollen-strom-sparen-muessen-aber-durchheizen-752943158085
Versicherte verlieren ungewöhnlich viel Geld in der Pensionskasse,https://www.tagesanzeiger.ch//whirlpool-besitzer-wollen-strom-sparen-muessen-aber-durchheizen-752943158085
Aktie der Credit Suisse stürzt erneut ab,https://www.tagesanzeiger.ch//whirlpool-besitzer-wollen-strom-sparen-muessen-aber-durchheizen-752943158085
Putins Ton hat eine gefährliche neue Qualität,https://www.tagesanzeiger.ch//whirlpool-besitzer-wollen-strom-sparen-muessen-aber-durchheizen-752943158085
Die aufregendsten Schwestern der Schweizer Politik,https://www.tagesanzeiger.ch//whirlpool-besitzer-wollen-strom-sparen-muessen-aber-durchheizen-752943158085
