frontstory,url
Jedes Jahr werden über 100’000 Pillen danach verkauft,https://www.tagesanzeiger.ch//jedes-jahr-werden-ueber-100000-pillen-danach-verkauft-480240242967
Swiss stellt im grossen Stil Crews aus dem Ausland an,https://www.tagesanzeiger.ch//jedes-jahr-werden-ueber-100000-pillen-danach-verkauft-480240242967
Moskau wirft EU-Ländern «Nazi-Politik» vor | Kiewer Bürger besichtigen erbeutete Panzer,https://www.tagesanzeiger.ch//jedes-jahr-werden-ueber-100000-pillen-danach-verkauft-480240242967
Weltweit blüht das Milliardengeschäft mit Killerdrohnen,https://www.tagesanzeiger.ch//jedes-jahr-werden-ueber-100000-pillen-danach-verkauft-480240242967
"«Ich bin nicht jemand, der mit Wut läuft, ich muss mich freuen»",https://www.tagesanzeiger.ch//jedes-jahr-werden-ueber-100000-pillen-danach-verkauft-480240242967
"«Alle sagen, es geht um Sex. Dabei quasseln wir die ganze Zeit»",https://www.tagesanzeiger.ch//jedes-jahr-werden-ueber-100000-pillen-danach-verkauft-480240242967
