frontstory,url
«Wir werden nie mehr zurückkommen. Never»,https://www.tagesanzeiger.ch//wir-werden-nie-mehr-zurueckkommen-never-524092442504
Kiewer Truppen rücken im Osten und Süden vor  Russische Mobilmachung: Region holt «Hälfte» der Männer heim,https://www.tagesanzeiger.ch//wir-werden-nie-mehr-zurueckkommen-never-524092442504
Wie junge Erwachsene ihre Altersvorsorge stärken können,https://www.tagesanzeiger.ch//wir-werden-nie-mehr-zurueckkommen-never-524092442504
Aktie der Credit Suisse stürzt erneut ab,https://www.tagesanzeiger.ch//wir-werden-nie-mehr-zurueckkommen-never-524092442504
Whirlpool-Besitzer müssen im Winter durchheizen,https://www.tagesanzeiger.ch//wir-werden-nie-mehr-zurueckkommen-never-524092442504
Nach der Kehrtwende von Truss hagelt es erneut Kritik,https://www.tagesanzeiger.ch//wir-werden-nie-mehr-zurueckkommen-never-524092442504
