frontstory,url
"Kinder lernen, wenn ihr Gehirn so weit ist",https://www.tagesanzeiger.ch//kinder-lernen-wenn-ihr-gehirn-so-weit-ist-348351943682
Russlands Hardliner sind wütend und fordern Konsequenzen,https://www.tagesanzeiger.ch//kinder-lernen-wenn-ihr-gehirn-so-weit-ist-348351943682
Nach der Rückeroberung,https://www.tagesanzeiger.ch//kinder-lernen-wenn-ihr-gehirn-so-weit-ist-348351943682
Kinder der Queen halten in Edinburgh die Totenwache | Zwei Tage vor Queen-Aufbahrung in London warten schon erste Trauernde,https://www.tagesanzeiger.ch//kinder-lernen-wenn-ihr-gehirn-so-weit-ist-348351943682
Nun will Deutschland Geld von der Schweiz ,https://www.tagesanzeiger.ch//kinder-lernen-wenn-ihr-gehirn-so-weit-ist-348351943682
Politik sucht händeringend nach Lösung für hohe Strompreise,https://www.tagesanzeiger.ch//kinder-lernen-wenn-ihr-gehirn-so-weit-ist-348351943682
