frontstory,url
Es fühlt sich an wie der Abschied von einem Vertrauten,https://www.tagesanzeiger.ch//es-fuehlt-sich-an-wie-der-abschied-von-einem-vertrauten-127823619437
"«Ich wünschte, dieser Tag wäre nie gekommen»",https://www.tagesanzeiger.ch//es-fuehlt-sich-an-wie-der-abschied-von-einem-vertrauten-127823619437
Unsere besten Karikaturen mit Roger Federer,https://www.tagesanzeiger.ch//es-fuehlt-sich-an-wie-der-abschied-von-einem-vertrauten-127823619437
Moskau warnt USA vor Lieferung von Raketen mit grösseren Reichweiten | Selenski: Massengrab in zurückeroberter Stadt Isjum entdeckt,https://www.tagesanzeiger.ch//es-fuehlt-sich-an-wie-der-abschied-von-einem-vertrauten-127823619437
«Ein guter Morgen. Ein genialer Morgen. Top. Top. Top»,https://www.tagesanzeiger.ch//es-fuehlt-sich-an-wie-der-abschied-von-einem-vertrauten-127823619437
Endlich setzt das Parlament ein klares Signal,https://www.tagesanzeiger.ch//es-fuehlt-sich-an-wie-der-abschied-von-einem-vertrauten-127823619437
