frontstory,url
"«Zürich lebt in einer ideologischen Wolke, die an der Stadtgrenze aufhört»",https://www.tagesanzeiger.ch//zuerich-lebt-in-einer-ideologischen-wolke-die-an-der-stadtgrenze-aufhoert-306034297468
"Inflation im August auf 3,5 Prozent gestiegen",https://www.tagesanzeiger.ch//zuerich-lebt-in-einer-ideologischen-wolke-die-an-der-stadtgrenze-aufhoert-306034297468
Bachelet publiziert Uiguren-Bericht Minuten vor Ende ihrer Amtszeit  ,https://www.tagesanzeiger.ch//zuerich-lebt-in-einer-ideologischen-wolke-die-an-der-stadtgrenze-aufhoert-306034297468
Daniel Leupi möchte in den Ständerat,https://www.tagesanzeiger.ch//zuerich-lebt-in-einer-ideologischen-wolke-die-an-der-stadtgrenze-aufhoert-306034297468
Russland beschiesst laut Kiew Stadt bei AKW Saporischschja | Internationale Atomexperten sind unterwegs,https://www.tagesanzeiger.ch//zuerich-lebt-in-einer-ideologischen-wolke-die-an-der-stadtgrenze-aufhoert-306034297468
Und so geht Strom sparen für Fortgeschrittene,https://www.tagesanzeiger.ch//zuerich-lebt-in-einer-ideologischen-wolke-die-an-der-stadtgrenze-aufhoert-306034297468
