frontstory,url
"«Zürich lebt in einer ideologischen Wolke, die an der Stadtgrenze aufhört»",https://www.tagesanzeiger.ch//zuerich-lebt-in-einer-ideologischen-wolke-die-an-der-stadtgrenze-aufhoert-306034297468
Spitäler Uster und Affoltern müssen nicht schliessen,https://www.tagesanzeiger.ch//zuerich-lebt-in-einer-ideologischen-wolke-die-an-der-stadtgrenze-aufhoert-306034297468
Russland beschiesst laut Kiew Stadt bei AKW | Ukrainer greifen im Süden offenbar mit Langstreckenraketen an,https://www.tagesanzeiger.ch//zuerich-lebt-in-einer-ideologischen-wolke-die-an-der-stadtgrenze-aufhoert-306034297468
Überraschende Niederlage für Palin und Trump ,https://www.tagesanzeiger.ch//zuerich-lebt-in-einer-ideologischen-wolke-die-an-der-stadtgrenze-aufhoert-306034297468
«Sonst wäre ich immer am Handy und würde ihm Fotos schicken»,https://www.tagesanzeiger.ch//zuerich-lebt-in-einer-ideologischen-wolke-die-an-der-stadtgrenze-aufhoert-306034297468
Daniel Leupi möchte in den Ständerat,https://www.tagesanzeiger.ch//zuerich-lebt-in-einer-ideologischen-wolke-die-an-der-stadtgrenze-aufhoert-306034297468
