frontstory,url
Hausbesuch bei den Masterminds der Schweizer Erfolgsserie,https://www.tagesanzeiger.ch//hausbesuch-bei-den-masterminds-der-schweizer-erfolgsserie-804576749272
Der neue Schützenkönig heisst Nils Oliver Stolz,https://www.tagesanzeiger.ch//hausbesuch-bei-den-masterminds-der-schweizer-erfolgsserie-804576749272
Dieser historische Schritt ist ein Zeichen politischer Reife,https://www.tagesanzeiger.ch//hausbesuch-bei-den-masterminds-der-schweizer-erfolgsserie-804576749272
Charles III. hält Rede vor dem Parlament | Tausende bei Trauerprozession in Edinburgh,https://www.tagesanzeiger.ch//hausbesuch-bei-den-masterminds-der-schweizer-erfolgsserie-804576749272
Stromausfall in weiten Teilen der Ostukraine nach Rückeroberung,https://www.tagesanzeiger.ch//hausbesuch-bei-den-masterminds-der-schweizer-erfolgsserie-804576749272
Die Winterlagerplätze für Boote werden knapp,https://www.tagesanzeiger.ch//hausbesuch-bei-den-masterminds-der-schweizer-erfolgsserie-804576749272
