frontstory,url
Trump wird wegen Betrugs angeklagt,https://www.tagesanzeiger.ch//trump-wird-angeklagt-902956859676
Ukraine spottet über Mobilisierung von 300’000 Reservisten,https://www.tagesanzeiger.ch//trump-wird-angeklagt-902956859676
Teilmobilmachung in Russland: Ansturm auf Flüge ins Ausland und mehrere Proteste  Cassis trifft Lawrow in New York,https://www.tagesanzeiger.ch//trump-wird-angeklagt-902956859676
"US-Notenbank Fed erhöht Leitzins erneut deutlich um 0,75 Prozentpunkte  Ölpreise legen nach Teilmobilmachung Russlands zu",https://www.tagesanzeiger.ch//trump-wird-angeklagt-902956859676
Ein Baby stirbt an massiven Verletzungen – wer ist schuld?,https://www.tagesanzeiger.ch//trump-wird-angeklagt-902956859676
Mit der Pension kommt die Krise – ein neuer Film befasst sich mit den «goldenen Jahren»,https://www.tagesanzeiger.ch//trump-wird-angeklagt-902956859676
