frontstory,url
Die Informatikbranche 체berholt die Schweizer Banken,https://www.tagesanzeiger.ch//die-informatikbranche-ueberholt-die-schweizer-banken-487566753185
Ein Coup! Ein Putsch! Wie die Schweiz in Rekordzeit ein Solargesetz erh채lt,https://www.tagesanzeiger.ch//die-informatikbranche-ueberholt-die-schweizer-banken-487566753185
Keine Vorstellung von echter Diversit채t,https://www.tagesanzeiger.ch//die-informatikbranche-ueberholt-die-schweizer-banken-487566753185
5000 russische Soldaten gem채ss Ukraine in Lyman eingekesselt  Chef von AKW Saporischschja verschleppt,https://www.tagesanzeiger.ch//die-informatikbranche-ueberholt-die-schweizer-banken-487566753185
Wir sehen uns in Tbilissi,https://www.tagesanzeiger.ch//die-informatikbranche-ueberholt-die-schweizer-banken-487566753185
Die Schweiz hat noch keinen Strom gespart,https://www.tagesanzeiger.ch//die-informatikbranche-ueberholt-die-schweizer-banken-487566753185
