frontstory,url
"«In der Schweiz glauben wir, alle Probleme mit mehr Bildung lösen zu können»",https://www.tagesanzeiger.ch//in-der-schweiz-glauben-wir-alle-probleme-mit-mehr-bildung-loesen-zu-koennen-144176920272
"CIA spionierte in Kabul, Hellfire-Rakete traf Zawahri auf dem Balkon",https://www.tagesanzeiger.ch//in-der-schweiz-glauben-wir-alle-probleme-mit-mehr-bildung-loesen-zu-koennen-144176920272
"«Wie viel habt Ihr investiert?» – «Ich 100'000, meine Schwester 50'000»",https://www.tagesanzeiger.ch//in-der-schweiz-glauben-wir-alle-probleme-mit-mehr-bildung-loesen-zu-koennen-144176920272
Moskau stuft ukrainisches Asow-Regiment als «terroristisch» ein | London: Russische Flotte im Schwarzen Meer nach Angriff geschwächt ,https://www.tagesanzeiger.ch//in-der-schweiz-glauben-wir-alle-probleme-mit-mehr-bildung-loesen-zu-koennen-144176920272
Pelosi soll in wenigen Stunden in Taiwan landen – China fährt Kriegsschiffe auf,https://www.tagesanzeiger.ch//in-der-schweiz-glauben-wir-alle-probleme-mit-mehr-bildung-loesen-zu-koennen-144176920272
"Italien hört nicht auf, die Welt zu verblüffen",https://www.tagesanzeiger.ch//in-der-schweiz-glauben-wir-alle-probleme-mit-mehr-bildung-loesen-zu-koennen-144176920272
