frontstory,url
"«Kommt die AHV-Reform durch, ist der nächste Schritt Rentenalter 67 für alle»",https://www.tagesanzeiger.ch//kommt-die-ahv-reform-durch-ist-der-naechste-schritt-rentenalter-67-fuer-alle-277093623449
Credit Suisse baut Geschäftsleitung um,https://www.tagesanzeiger.ch//kommt-die-ahv-reform-durch-ist-der-naechste-schritt-rentenalter-67-fuer-alle-277093623449
Wie schütze ich mein Vermögen vor der Inflation?,https://www.tagesanzeiger.ch//kommt-die-ahv-reform-durch-ist-der-naechste-schritt-rentenalter-67-fuer-alle-277093623449
Krim: Russische Flugabwehr schiesst «Objekte» ab | Ukraine wehrt Angriffe im Osten und Süden ab,https://www.tagesanzeiger.ch//kommt-die-ahv-reform-durch-ist-der-naechste-schritt-rentenalter-67-fuer-alle-277093623449
«Zoos können Tiere vor dem Aussterben retten»,https://www.tagesanzeiger.ch//kommt-die-ahv-reform-durch-ist-der-naechste-schritt-rentenalter-67-fuer-alle-277093623449
"«Sie dürfen bleiben, solange sie wollen»: Gastfamilien übertreffen Erwartungen",https://www.tagesanzeiger.ch//kommt-die-ahv-reform-durch-ist-der-naechste-schritt-rentenalter-67-fuer-alle-277093623449
