frontstory,url
"Wer auf Gas verzichten muss, wenn sich die Lage zuspitzt",https://www.tagesanzeiger.ch//wer-auf-gas-verzichten-muss-wenn-sich-die-lage-zuspitzt-278505266677
Wärmebilder und Tipps: Mit dieser Kampagne soll die Schweiz Energie sparen,https://www.tagesanzeiger.ch//wer-auf-gas-verzichten-muss-wenn-sich-die-lage-zuspitzt-278505266677
«80 Prozent sind weiblich und zwischen 25 und 40 Jahre alt»,https://www.tagesanzeiger.ch//wer-auf-gas-verzichten-muss-wenn-sich-die-lage-zuspitzt-278505266677
Schweiz passt Sanktionen gegen Russland an | EU setzt Visa-Abkommen mit Russland aus ,https://www.tagesanzeiger.ch//wer-auf-gas-verzichten-muss-wenn-sich-die-lage-zuspitzt-278505266677
Putin zerbombt Gorbatschows Vermächtnis,https://www.tagesanzeiger.ch//wer-auf-gas-verzichten-muss-wenn-sich-die-lage-zuspitzt-278505266677
Der Sommer 2022 ist ein Jahrhundertereignis,https://www.tagesanzeiger.ch//wer-auf-gas-verzichten-muss-wenn-sich-die-lage-zuspitzt-278505266677
