frontstory,url
Hinter der Trauer verbirgt sich Verunsicherung,https://www.tagesanzeiger.ch//hinter-der-trauer-verbirgt-sich-verunsicherung-650006523914
«Der Bundesrat soll schon jetzt die Strom­mangel­lage ausrufen»,https://www.tagesanzeiger.ch//hinter-der-trauer-verbirgt-sich-verunsicherung-650006523914
"Sie verlangen offen, dass Putin geht",https://www.tagesanzeiger.ch//hinter-der-trauer-verbirgt-sich-verunsicherung-650006523914
So gespalten sind die Republikaner,https://www.tagesanzeiger.ch//hinter-der-trauer-verbirgt-sich-verunsicherung-650006523914
Mit Kleinkindern an Bord sind sie um die Welt gesegelt,https://www.tagesanzeiger.ch//hinter-der-trauer-verbirgt-sich-verunsicherung-650006523914
"«Zürich, zeig mir deine Energie!»",https://www.tagesanzeiger.ch//hinter-der-trauer-verbirgt-sich-verunsicherung-650006523914
