frontstory,url
SVP will Energieministerin Sommaruga mit Ueli Maurer ersetzen,https://www.tagesanzeiger.ch//sommaruga-ist-der-schwierigen-situation-nicht-gewachsen-923359759362
Sommaruga: Energiewende ist machbar | Putin gratuliert Bundespräsident Cassis zum Nationalfeiertag,https://www.tagesanzeiger.ch//sommaruga-ist-der-schwierigen-situation-nicht-gewachsen-923359759362
Der Tausendsassa sang am lautesten,https://www.tagesanzeiger.ch//sommaruga-ist-der-schwierigen-situation-nicht-gewachsen-923359759362
USA kündigen weitere Rüstungslieferungen an | Ukraine erobert laut eigenen Angaben 46 Orte zurück,https://www.tagesanzeiger.ch//sommaruga-ist-der-schwierigen-situation-nicht-gewachsen-923359759362
"«Macht Platz, Jungs, wir haben unseren Pokal»",https://www.tagesanzeiger.ch//sommaruga-ist-der-schwierigen-situation-nicht-gewachsen-923359759362
Und die Frisur hält,https://www.tagesanzeiger.ch//sommaruga-ist-der-schwierigen-situation-nicht-gewachsen-923359759362
