frontstory,url
Kambundji sprintet über 200 Meter sensationell zu Gold,https://www.tagesanzeiger.ch//kambundji-sprintet-ueber-200-meter-sensationell-zu-gold-665889772263
Axpo winkt dreistelliger Millionenbetrag aus deutscher Gasabgabe,https://www.tagesanzeiger.ch//kambundji-sprintet-ueber-200-meter-sensationell-zu-gold-665889772263
Sie erpressen die Welt,https://www.tagesanzeiger.ch//kambundji-sprintet-ueber-200-meter-sensationell-zu-gold-665889772263
"«Ich ertappte mich dabei, wie mich der dunkelhäutige Nachrichtensprecher störte»",https://www.tagesanzeiger.ch//kambundji-sprintet-ueber-200-meter-sensationell-zu-gold-665889772263
Strompreise für Haushalte steigen um 30 Prozent,https://www.tagesanzeiger.ch//kambundji-sprintet-ueber-200-meter-sensationell-zu-gold-665889772263
"SRF löscht Beitrag, und die SVP erhebt Vorwürfe",https://www.tagesanzeiger.ch//kambundji-sprintet-ueber-200-meter-sensationell-zu-gold-665889772263
