frontstory,url
"«Sie dürfen bleiben, solange sie wollen»: Gastfamilien übertreffen Erwartungen",https://www.tagesanzeiger.ch//sie-duerfen-bleiben-solange-sie-wollen-gastfamilien-uebertreffen-erwartungen-553901925234
Credit Suisse baut Geschäftsleitung um,https://www.tagesanzeiger.ch//sie-duerfen-bleiben-solange-sie-wollen-gastfamilien-uebertreffen-erwartungen-553901925234
Warum die Schweiz so erfolgreich ist wie nie ,https://www.tagesanzeiger.ch//sie-duerfen-bleiben-solange-sie-wollen-gastfamilien-uebertreffen-erwartungen-553901925234
Krim: Russische Flugabwehr schiesst «Objekte» ab | Ukraine wehrt Angriffe im Osten und Süden ab,https://www.tagesanzeiger.ch//sie-duerfen-bleiben-solange-sie-wollen-gastfamilien-uebertreffen-erwartungen-553901925234
Und dann sammelten sie innert vier Stunden 100’000 Franken,https://www.tagesanzeiger.ch//sie-duerfen-bleiben-solange-sie-wollen-gastfamilien-uebertreffen-erwartungen-553901925234
«Manche Eltern haben falsche Befürchtungen zur lustbetonten Schule»,https://www.tagesanzeiger.ch//sie-duerfen-bleiben-solange-sie-wollen-gastfamilien-uebertreffen-erwartungen-553901925234
