frontstory,url
Wie ökologisch sind die Zürcher Spitäler?,https://www.tagesanzeiger.ch//wie-oekologisch-sind-die-zuercher-spitaeler-142156239871
"Auto-Navi, Tracker, Notruf im Lift: Ältere Geräte funktionieren bald nicht mehr",https://www.tagesanzeiger.ch//wie-oekologisch-sind-die-zuercher-spitaeler-142156239871
Welche Partei würden Sie heute wählen?,https://www.tagesanzeiger.ch//wie-oekologisch-sind-die-zuercher-spitaeler-142156239871
Russische AKW-Besatzer schlagen Feuerpause vor | Moskaus Pläne für Anschluss Donezks laut London weit fortgeschritten ,https://www.tagesanzeiger.ch//wie-oekologisch-sind-die-zuercher-spitaeler-142156239871
Die befürchtete Palmöl-Schwemme bleibt aus  ,https://www.tagesanzeiger.ch//wie-oekologisch-sind-die-zuercher-spitaeler-142156239871
Die Badewanne dient ihrer Tochter als Schutz vor Granaten,https://www.tagesanzeiger.ch//wie-oekologisch-sind-die-zuercher-spitaeler-142156239871
