frontstory,url
"«Wenn Xenia irgendwann nicht mehr will, müssen wir das akzeptieren»",https://www.tagesanzeiger.ch//wenn-xenia-irgendwann-nicht-mehr-will-muessen-wir-das-akzeptieren-754694308613
Biden und Macron wollen sich nicht in den Bus quetschen,https://www.tagesanzeiger.ch//wenn-xenia-irgendwann-nicht-mehr-will-muessen-wir-das-akzeptieren-754694308613
Kiew schliesst Verhandlungen mit Putin zurzeit aus | Russischer Popstar kritisiert Krieg gegen die Ukraine scharf ,https://www.tagesanzeiger.ch//wenn-xenia-irgendwann-nicht-mehr-will-muessen-wir-das-akzeptieren-754694308613
Diese 51 Millionen muss es uns für die Kinder wert sein,https://www.tagesanzeiger.ch//wenn-xenia-irgendwann-nicht-mehr-will-muessen-wir-das-akzeptieren-754694308613
2:3 in Lausanne – war es das für FCZ-Trainer Foda?,https://www.tagesanzeiger.ch//wenn-xenia-irgendwann-nicht-mehr-will-muessen-wir-das-akzeptieren-754694308613
Wie Babys am besten einschlafen,https://www.tagesanzeiger.ch//wenn-xenia-irgendwann-nicht-mehr-will-muessen-wir-das-akzeptieren-754694308613
