frontstory,url
Royal Family auf dem Weg nach Windsor  Sarg der Königin in Leichenwagen umgebettet,https://www.tagesanzeiger.ch//grossbritannien-nimmt-abschied-von-seiner-koenigin-887034523956
Die eindrücklichsten Bilder des Queen-Begräbnisses,https://www.tagesanzeiger.ch//grossbritannien-nimmt-abschied-von-seiner-koenigin-887034523956
Schweiz unterzeichnet Kaufvertrag für F-35,https://www.tagesanzeiger.ch//grossbritannien-nimmt-abschied-von-seiner-koenigin-887034523956
Experten: Putin setzt auf improvisierte Truppen  London: Russische Luftwaffe immer stärker unter Druck,https://www.tagesanzeiger.ch//grossbritannien-nimmt-abschied-von-seiner-koenigin-887034523956
"Wie der Krieg die Marken in Russland verändert
",https://www.tagesanzeiger.ch//grossbritannien-nimmt-abschied-von-seiner-koenigin-887034523956
Die Diktatur fürchtet ihre Bürger  ,https://www.tagesanzeiger.ch//grossbritannien-nimmt-abschied-von-seiner-koenigin-887034523956
