frontstory,url
Der grösste Geschlechter­graben der Geschichte,https://www.tagesanzeiger.ch//der-groesste-geschlechtergraben-aller-zeiten-820513605498
Nachwahlbefragungen: Radikale Rechte liegt vorne,https://www.tagesanzeiger.ch//der-groesste-geschlechtergraben-aller-zeiten-820513605498
Nun spannen Tierschutz und Bauernverband zusammen,https://www.tagesanzeiger.ch//der-groesste-geschlechtergraben-aller-zeiten-820513605498
So hat Ihre Gemeinde abgestimmt,https://www.tagesanzeiger.ch//der-groesste-geschlechtergraben-aller-zeiten-820513605498
Nach dem Ja steht das SBB-Wohnprojekt vor dem Aus,https://www.tagesanzeiger.ch//der-groesste-geschlechtergraben-aller-zeiten-820513605498
Der günstigere Zmittag gewinnt,https://www.tagesanzeiger.ch//der-groesste-geschlechtergraben-aller-zeiten-820513605498
