frontstory,url
«Dick wie ein Kinderarm» – Schlangen breiten sich in Zürcher Familiengärten aus,https://www.tagesanzeiger.ch//in-zuercher-familiengaerten-haeufen-sich-begegnungen-mit-schlangen-197356095892
Fast zwei Drittel der Frauen sind gegen eine Erhöhung des Rentenalters,https://www.tagesanzeiger.ch//in-zuercher-familiengaerten-haeufen-sich-begegnungen-mit-schlangen-197356095892
Was ist auf der russischen Luftwaffenbasis passiert?,https://www.tagesanzeiger.ch//in-zuercher-familiengaerten-haeufen-sich-begegnungen-mit-schlangen-197356095892
"Sollte der Markt weiter abschmieren, droht Peking die Totalkrise",https://www.tagesanzeiger.ch//in-zuercher-familiengaerten-haeufen-sich-begegnungen-mit-schlangen-197356095892
Das Phänomen Simon Ehammer,https://www.tagesanzeiger.ch//in-zuercher-familiengaerten-haeufen-sich-begegnungen-mit-schlangen-197356095892
Zuckerberg hat auch das Abkupfern nicht erfunden,https://www.tagesanzeiger.ch//in-zuercher-familiengaerten-haeufen-sich-begegnungen-mit-schlangen-197356095892
