frontstory,url
Die Aufsicht des Bundes über die Swiss-Rettung war zu schwach,https://www.tagesanzeiger.ch//die-aufsicht-des-bundes-ueber-die-swiss-rettung-war-zu-schwach-990702874933
Für die Ukraine verheisst der Anschlag nichts Gutes,https://www.tagesanzeiger.ch//die-aufsicht-des-bundes-ueber-die-swiss-rettung-war-zu-schwach-990702874933
Forscher warnen vor Massensterben im Wasser,https://www.tagesanzeiger.ch//die-aufsicht-des-bundes-ueber-die-swiss-rettung-war-zu-schwach-990702874933
Vater sendet Fotos vom nackten Sohn an Arzt – Google alarmiert die Polizei,https://www.tagesanzeiger.ch//die-aufsicht-des-bundes-ueber-die-swiss-rettung-war-zu-schwach-990702874933
Siesta trotz Stromkrise? Parteien greifen grünen Energieminister frontal an,https://www.tagesanzeiger.ch//die-aufsicht-des-bundes-ueber-die-swiss-rettung-war-zu-schwach-990702874933
«Die Kritik an den Laienlehrern ist übertrieben»,https://www.tagesanzeiger.ch//die-aufsicht-des-bundes-ueber-die-swiss-rettung-war-zu-schwach-990702874933
