frontstory,url
In diesen 46 Gebieten könnten Windräder hinkommen,https://www.tagesanzeiger.ch//martin-neukom-hat-46-gebiete-fuer-windraeder-im-visier-348306189886
"Friedens­nobel­preis geht nach Belarus, Russland und in die Ukraine",https://www.tagesanzeiger.ch//martin-neukom-hat-46-gebiete-fuer-windraeder-im-visier-348306189886
"Die Lage am Gasmarkt entspannt sich, die Preise sinken",https://www.tagesanzeiger.ch//martin-neukom-hat-46-gebiete-fuer-windraeder-im-visier-348306189886
Selenski verstört mit Forderung nach «Präventivschlag»  Biden warnt vor atomarer «Apokalypse»,https://www.tagesanzeiger.ch//martin-neukom-hat-46-gebiete-fuer-windraeder-im-visier-348306189886
Wer ist schuld am Debakel? – Putins Schergen streiten sich öffentlich,https://www.tagesanzeiger.ch//martin-neukom-hat-46-gebiete-fuer-windraeder-im-visier-348306189886
Muss das sein?,https://www.tagesanzeiger.ch//martin-neukom-hat-46-gebiete-fuer-windraeder-im-visier-348306189886
