frontstory,url
Jetzt rentiert die Fotovoltaikanlage endlich ,https://www.tagesanzeiger.ch//jetzt-rentiert-die-fotovoltaikanlage-endlich-546475992852
Das sollten jetzt alle Frauen wissen,https://www.tagesanzeiger.ch//jetzt-rentiert-die-fotovoltaikanlage-endlich-546475992852
Albert Röstis Coup für die Grimsel-Staumauer,https://www.tagesanzeiger.ch//jetzt-rentiert-die-fotovoltaikanlage-endlich-546475992852
Lassen sich Putins Truppen schon wieder überrumpeln? ,https://www.tagesanzeiger.ch//jetzt-rentiert-die-fotovoltaikanlage-endlich-546475992852
Die Stadt testet den Spurabbau auf der Bellerivestrasse jetzt doch,https://www.tagesanzeiger.ch//jetzt-rentiert-die-fotovoltaikanlage-endlich-546475992852
"Der Ständerat zeigt Herz für die Alten, jedoch nicht für die Ärmeren ",https://www.tagesanzeiger.ch//jetzt-rentiert-die-fotovoltaikanlage-endlich-546475992852
