frontstory,url
"Die Lage am Gasmarkt entspannt sich, die Preise sinken",https://www.tagesanzeiger.ch//die-lage-am-gasmarkt-entspannt-sich-die-preise-sinken-686951082523
Kommt jetzt wieder die Maskenpflicht?,https://www.tagesanzeiger.ch//die-lage-am-gasmarkt-entspannt-sich-die-preise-sinken-686951082523
Wenn der Preishammer doppelt zuschlägt,https://www.tagesanzeiger.ch//die-lage-am-gasmarkt-entspannt-sich-die-preise-sinken-686951082523
Selenski warnt vor russischem Angriff auf Zentraleuropa  «Kleine ukrainische Angriffstruppen sind den Russen überlegen»,https://www.tagesanzeiger.ch//die-lage-am-gasmarkt-entspannt-sich-die-preise-sinken-686951082523
So nahe am «Armageddon» wie seit Kuba-Krise nicht mehr,https://www.tagesanzeiger.ch//die-lage-am-gasmarkt-entspannt-sich-die-preise-sinken-686951082523
12 Stunden Fahrt zur Abtreibungsklinik,https://www.tagesanzeiger.ch//die-lage-am-gasmarkt-entspannt-sich-die-preise-sinken-686951082523
