frontstory,url
"Biden, Macron und Cassis eingetroffen – Westminster Abbey füllt sich",https://www.tagesanzeiger.ch//grossbritannien-nimmt-abschied-von-seiner-koenigin-887034523956
5000 Franken weniger im Portemonnaie,https://www.tagesanzeiger.ch//grossbritannien-nimmt-abschied-von-seiner-koenigin-887034523956
Kantone planen Solar-Zwang für alle Hausbesitzer,https://www.tagesanzeiger.ch//grossbritannien-nimmt-abschied-von-seiner-koenigin-887034523956
London: Russische Luftwaffe in Ukraine immer stärker unter Druck  Kiew: Russland bombardiert Gelände von AKW im Süden der Ukraine,https://www.tagesanzeiger.ch//grossbritannien-nimmt-abschied-von-seiner-koenigin-887034523956
Frau wegen Kopftuch zu Tode geprügelt: Die Diktatur fürchtet ihre Bürger  ,https://www.tagesanzeiger.ch//grossbritannien-nimmt-abschied-von-seiner-koenigin-887034523956
Die Schweiz gibt Deutschland einen Vorgeschmack,https://www.tagesanzeiger.ch//grossbritannien-nimmt-abschied-von-seiner-koenigin-887034523956
