frontstory,url
Herr Padrun (77) muss mit 2300 Franken im Monat auskommen,https://www.tagesanzeiger.ch//herr-padrun-77-muss-mit-2300-franken-im-monat-auskommen-890288834928
Maurers Rücktritt ist gut für die Schweiz,https://www.tagesanzeiger.ch//herr-padrun-77-muss-mit-2300-franken-im-monat-auskommen-890288834928
Sergeis Flucht nach Bern,https://www.tagesanzeiger.ch//herr-padrun-77-muss-mit-2300-franken-im-monat-auskommen-890288834928
London: Hohe russische Verluste bei Rückzug aus Liman  Russen kritisieren eigene Militärführung heftig,https://www.tagesanzeiger.ch//herr-padrun-77-muss-mit-2300-franken-im-monat-auskommen-890288834928
«Eine Woche über 45 Grad kann uns an den Rand bringen»,https://www.tagesanzeiger.ch//herr-padrun-77-muss-mit-2300-franken-im-monat-auskommen-890288834928
Wenn der Wirt König ist,https://www.tagesanzeiger.ch//herr-padrun-77-muss-mit-2300-franken-im-monat-auskommen-890288834928
