frontstory,url
Wie die Schweiz in Rekordzeit ein Solargesetz erhält,https://www.tagesanzeiger.ch//wie-die-schweiz-in-rekordzeit-ein-solargesetz-erhaelt-456169598006
«Es ist fast nichts übrig»,https://www.tagesanzeiger.ch//wie-die-schweiz-in-rekordzeit-ein-solargesetz-erhaelt-456169598006
Ukrainische Stadt Liman kurz vor der Rückeroberung  Putin räumt Fehler bei Teilmobilmachung ein,https://www.tagesanzeiger.ch//wie-die-schweiz-in-rekordzeit-ein-solargesetz-erhaelt-456169598006
EU: Energieunternehmen müssen übermässige Krisengewinne abgeben  Rekordwert: Inflation in Eurozone klettert auf 10 Prozent,https://www.tagesanzeiger.ch//wie-die-schweiz-in-rekordzeit-ein-solargesetz-erhaelt-456169598006
Linke und Rechte verhindern gemeinsam Änderungen bei Sanktionen  Ergänzter Titel des Klimaschutzgesetzes sorgt bei der SVP für Ärger,https://www.tagesanzeiger.ch//wie-die-schweiz-in-rekordzeit-ein-solargesetz-erhaelt-456169598006
Das Ende einer Kultmarke – weil die Fifa immer mehr Geld wollte,https://www.tagesanzeiger.ch//wie-die-schweiz-in-rekordzeit-ein-solargesetz-erhaelt-456169598006
