frontstory,url
«Wir müssen uns auf Wohlstandsverluste vorbereiten»,https://www.tagesanzeiger.ch//wir-muessen-uns-auf-wohlstandsverluste-vorbereiten-153584734856
Für die Ukraine verheisst der Anschlag nichts Gutes,https://www.tagesanzeiger.ch//wir-muessen-uns-auf-wohlstandsverluste-vorbereiten-153584734856
Republikaner gefährden ihre guten Chancen,https://www.tagesanzeiger.ch//wir-muessen-uns-auf-wohlstandsverluste-vorbereiten-153584734856
Flughafen Zürich steigert Umsatz stark,https://www.tagesanzeiger.ch//wir-muessen-uns-auf-wohlstandsverluste-vorbereiten-153584734856
Nun verschwindet die letzte englische Buchhandlung,https://www.tagesanzeiger.ch//wir-muessen-uns-auf-wohlstandsverluste-vorbereiten-153584734856
Geht Sanna Marin als Gewinnerin aus der Affäre hervor? ,https://www.tagesanzeiger.ch//wir-muessen-uns-auf-wohlstandsverluste-vorbereiten-153584734856
