frontstory,url
Peinlich für die Schweiz,https://www.tagesanzeiger.ch//peinlich-fuer-die-schweiz-133718124360
"Wann ist es sinnvoll, Handy, Auto oder Waschmaschine zu ersetzen?",https://www.tagesanzeiger.ch//peinlich-fuer-die-schweiz-133718124360
Neue russische Raketenangriffe auf ukrainische Städte  Moskau geht laut London Munition aus,https://www.tagesanzeiger.ch//peinlich-fuer-die-schweiz-133718124360
Preisentwicklung bei Eigenheimen normalisiert sich,https://www.tagesanzeiger.ch//peinlich-fuer-die-schweiz-133718124360
Videos geben Einblicke in die Welt einer «Drogengang»,https://www.tagesanzeiger.ch//peinlich-fuer-die-schweiz-133718124360
"«Egal, wie erfolgreich ich bin, ich muss immer bittibätti machen»",https://www.tagesanzeiger.ch//peinlich-fuer-die-schweiz-133718124360
