frontstory,url
Russland zieht Truppen aus strategisch wichtiger Stadt ab | Besatzer rufen Menschen im Gebiet Charkiw zur Flucht auf,https://www.tagesanzeiger.ch//ticker-ukraine-russland-krieg-wichtigste-news-3-230591284724
Nagra will Schweizer Atommüll im Zürcher Unterland entsorgen,https://www.tagesanzeiger.ch//ticker-ukraine-russland-krieg-wichtigste-news-3-230591284724
"Beben mit Stärke von 4,7 in der Schweiz spürbar",https://www.tagesanzeiger.ch//ticker-ukraine-russland-krieg-wichtigste-news-3-230591284724
Staatsbegräbnis der Queen am 19. September | Charles III. ist jetzt offiziell König,https://www.tagesanzeiger.ch//ticker-ukraine-russland-krieg-wichtigste-news-3-230591284724
König Charles III. übernimmt ein Milliardenimperium,https://www.tagesanzeiger.ch//ticker-ukraine-russland-krieg-wichtigste-news-3-230591284724
Eine Hinrichtung wie aus «Narcos»,https://www.tagesanzeiger.ch//ticker-ukraine-russland-krieg-wichtigste-news-3-230591284724
