frontstory,url
Sie will den Männerclub sprengen,https://www.tagesanzeiger.ch//sie-will-den-maennerclub-sprengen-555779683803
Der Mann mit dem Bundesratsgen fordert SVP-Topfavorit Rösti heraus,https://www.tagesanzeiger.ch//sie-will-den-maennerclub-sprengen-555779683803
"Friedens­nobel­preis geht nach Belarus, Russland und in die Ukraine",https://www.tagesanzeiger.ch//sie-will-den-maennerclub-sprengen-555779683803
UN-Menschenrechtsrat untersucht Lage in Russland  Selenski verstört mit Forderung nach «Präventivschlag»,https://www.tagesanzeiger.ch//sie-will-den-maennerclub-sprengen-555779683803
In diesen 46 Zürcher Gebieten könnten Windräder hinkommen,https://www.tagesanzeiger.ch//sie-will-den-maennerclub-sprengen-555779683803
«Eine Milliarde. Oder was immer du empfiehlst» – «Vielleicht zwei Milliarden»,https://www.tagesanzeiger.ch//sie-will-den-maennerclub-sprengen-555779683803
