frontstory,url
Der SRG-Insider der «Weltwoche» ist Verschwörungstheorien verfallen,https://www.tagesanzeiger.ch//der-srg-insider-der-weltwoche-ist-verschwoerungstheorien-verfallen-902719964560
Reden wir über Affenpocken,https://www.tagesanzeiger.ch//der-srg-insider-der-weltwoche-ist-verschwoerungstheorien-verfallen-902719964560
Bauern fordern höhere Milch- und Getreide-Preise,https://www.tagesanzeiger.ch//der-srg-insider-der-weltwoche-ist-verschwoerungstheorien-verfallen-902719964560
Putin-Freund Steven Seagal besucht Ostukraine | Mehrere Tote im Süden nach russischem Raketenangriff,https://www.tagesanzeiger.ch//der-srg-insider-der-weltwoche-ist-verschwoerungstheorien-verfallen-902719964560
Trump verweigert Aussage unter Eid und spricht von «grösster Hexenjagd» der US-Geschichte,https://www.tagesanzeiger.ch//der-srg-insider-der-weltwoche-ist-verschwoerungstheorien-verfallen-902719964560
Land unter Wasser,https://www.tagesanzeiger.ch//der-srg-insider-der-weltwoche-ist-verschwoerungstheorien-verfallen-902719964560
