frontstory,url
Credit Suisse sorgt mit vermeintlicher Beruhigungsspritze für Panik ,https://www.tagesanzeiger.ch//credit-suisse-sorgt-mit-vermeintlicher-beruhigungsspritze-fuer-panik-785850667340
Russische Journalistin wegen TV-Protest auf Fahndungsliste  Kiewer Truppen rücken im Osten und Süden vor,https://www.tagesanzeiger.ch//credit-suisse-sorgt-mit-vermeintlicher-beruhigungsspritze-fuer-panik-785850667340
«Wir werden nie mehr zurückkommen. Never»,https://www.tagesanzeiger.ch//credit-suisse-sorgt-mit-vermeintlicher-beruhigungsspritze-fuer-panik-785850667340
"Stocker schliesst Kandidatur aus, Rickli hält sich bedeckt",https://www.tagesanzeiger.ch//credit-suisse-sorgt-mit-vermeintlicher-beruhigungsspritze-fuer-panik-785850667340
Wie junge Erwachsene ihre Altersvorsorge stärken können,https://www.tagesanzeiger.ch//credit-suisse-sorgt-mit-vermeintlicher-beruhigungsspritze-fuer-panik-785850667340
Es begann mit einem heimlichen Projekt in Zürich ,https://www.tagesanzeiger.ch//credit-suisse-sorgt-mit-vermeintlicher-beruhigungsspritze-fuer-panik-785850667340
