frontstory,url
Bürgerliche Politikerinnen reagieren auf die Wut der linken Frauen,https://www.tagesanzeiger.ch//buergerliche-politikerinnen-reagieren-auf-die-wut-der-linken-frauen-344198040579
Heftigster Prämienschub seit über zehn Jahren,https://www.tagesanzeiger.ch//buergerliche-politikerinnen-reagieren-auf-die-wut-der-linken-frauen-344198040579
2:1-Sieg – die Schweiz geht mit Selbstvertrauen Richtung WM,https://www.tagesanzeiger.ch//buergerliche-politikerinnen-reagieren-auf-die-wut-der-linken-frauen-344198040579
Pro-russische Behörden vermelden Siege in Saporischschja und Cherson,https://www.tagesanzeiger.ch//buergerliche-politikerinnen-reagieren-auf-die-wut-der-linken-frauen-344198040579
Im Land der fliehenden Söhne,https://www.tagesanzeiger.ch//buergerliche-politikerinnen-reagieren-auf-die-wut-der-linken-frauen-344198040579
Nord-Stream-Pipelines wurden offenbar gesprengt,https://www.tagesanzeiger.ch//buergerliche-politikerinnen-reagieren-auf-die-wut-der-linken-frauen-344198040579
