frontstory,url
"Erst nannte sie ihn «Baby», dann liess sie ihn 22 Jahre fliegen",https://www.tagesanzeiger.ch//erst-nannte-sie-ihn-baby-dann-liess-sie-ihn-22-jahre-fliegen-218815148090
Der Rezo der Schweiz,https://www.tagesanzeiger.ch//erst-nannte-sie-ihn-baby-dann-liess-sie-ihn-22-jahre-fliegen-218815148090
Der dreckigste Fluss Europas,https://www.tagesanzeiger.ch//erst-nannte-sie-ihn-baby-dann-liess-sie-ihn-22-jahre-fliegen-218815148090
AKW ist wieder am Stromnetz | Biden warnt Moskau vor Einsatz nuklearer Waffen,https://www.tagesanzeiger.ch//erst-nannte-sie-ihn-baby-dann-liess-sie-ihn-22-jahre-fliegen-218815148090
Wie der Finanzjongleur Dieter Behring meinen Vater betrog,https://www.tagesanzeiger.ch//erst-nannte-sie-ihn-baby-dann-liess-sie-ihn-22-jahre-fliegen-218815148090
Acht Enkelinnen und Enkel der Queen halten Totenwache an ihrem Sarg | König Charles überrascht die Wartenden,https://www.tagesanzeiger.ch//erst-nannte-sie-ihn-baby-dann-liess-sie-ihn-22-jahre-fliegen-218815148090
