frontstory,url
Putins Propaganda-Pädagogen wollen nicht in der Ostukraine unterrichten,https://www.tagesanzeiger.ch//putins-propaganda-paedagogen-wollen-nicht-in-der-ostukraine-unterrichten-786993794507
Cassis’ Leute eröffnen ihr Trainingscamp im Sicherheitsrat,https://www.tagesanzeiger.ch//putins-propaganda-paedagogen-wollen-nicht-in-der-ostukraine-unterrichten-786993794507
Rechte Politiker laufen Sturm gegen «Staatszwang»,https://www.tagesanzeiger.ch//putins-propaganda-paedagogen-wollen-nicht-in-der-ostukraine-unterrichten-786993794507
Dritte-Säule-Fonds haben an Wert verloren,https://www.tagesanzeiger.ch//putins-propaganda-paedagogen-wollen-nicht-in-der-ostukraine-unterrichten-786993794507
Ist Giorgia Meloni Frau genug?,https://www.tagesanzeiger.ch//putins-propaganda-paedagogen-wollen-nicht-in-der-ostukraine-unterrichten-786993794507
Wieso die Bidens neben Cassis sassen,https://www.tagesanzeiger.ch//putins-propaganda-paedagogen-wollen-nicht-in-der-ostukraine-unterrichten-786993794507
