frontstory,url
"«Sie dürfen bleiben, solange sie wollen»: Gastfamilien übertreffen Erwartungen",https://www.tagesanzeiger.ch//sie-duerfen-bleiben-solange-sie-wollen-gastfamilien-uebertreffen-erwartungen-553901925234
Warum die Schweiz so erfolgreich ist wie nie ,https://www.tagesanzeiger.ch//sie-duerfen-bleiben-solange-sie-wollen-gastfamilien-uebertreffen-erwartungen-553901925234
"Was ist wichtiger, mehr Strom oder die Fische?",https://www.tagesanzeiger.ch//sie-duerfen-bleiben-solange-sie-wollen-gastfamilien-uebertreffen-erwartungen-553901925234
Krim: Russische Flugabwehr schiesst «Objekte» ab | Ukraine wehrt Angriffe im Osten und Süden ab,https://www.tagesanzeiger.ch//sie-duerfen-bleiben-solange-sie-wollen-gastfamilien-uebertreffen-erwartungen-553901925234
"«Geliebt werden zu wollen, ist eines der grössten Karriere­hindernisse für Frauen»",https://www.tagesanzeiger.ch//sie-duerfen-bleiben-solange-sie-wollen-gastfamilien-uebertreffen-erwartungen-553901925234
Höhere Ziele erfordern grössere Raketen,https://www.tagesanzeiger.ch//sie-duerfen-bleiben-solange-sie-wollen-gastfamilien-uebertreffen-erwartungen-553901925234
