frontstory,url
"Arbeiten bis zum Umfallen? Nein, danke!",https://www.tagesanzeiger.ch//arbeiten-bis-zum-umfallen-nein-danke-659056344266
Fans mit Viagogo-Ticket für Zürcher Ed-Sheeran-Konzerte riskieren teuren Frust,https://www.tagesanzeiger.ch//arbeiten-bis-zum-umfallen-nein-danke-659056344266
Mordfall Dugina: Weiterer Tatverdächtiger | IAEA-Experten reisen nach Saporischschja,https://www.tagesanzeiger.ch//arbeiten-bis-zum-umfallen-nein-danke-659056344266
Wie war der Schulstart für Ihre Kinder?,https://www.tagesanzeiger.ch//arbeiten-bis-zum-umfallen-nein-danke-659056344266
Der Millionenschwung des neuen Königs war irregulär,https://www.tagesanzeiger.ch//arbeiten-bis-zum-umfallen-nein-danke-659056344266
"«Sie träumen  in der Nacht bestimmt von mir», sagt Bolsonaro",https://www.tagesanzeiger.ch//arbeiten-bis-zum-umfallen-nein-danke-659056344266
