frontstory,url
«Diese Raketen sind eigentlich zu teuer für den Einsatz als Terrorwaffe»,https://www.tagesanzeiger.ch//diese-raketen-sind-eigentlich-zu-teuer-fuer-den-einsatz-als-terrorwaffe-142293129388
Virales Video verifiziert: Junge Frau filmt Explosion neben Uni in Kiew,https://www.tagesanzeiger.ch//diese-raketen-sind-eigentlich-zu-teuer-fuer-den-einsatz-als-terrorwaffe-142293129388
Er ist das Gesicht der SVP – und doch ganz anders,https://www.tagesanzeiger.ch//diese-raketen-sind-eigentlich-zu-teuer-fuer-den-einsatz-als-terrorwaffe-142293129388
Swiss-Flugzeug muss wegen «ungewöhnlichem Geruch» notlanden,https://www.tagesanzeiger.ch//diese-raketen-sind-eigentlich-zu-teuer-fuer-den-einsatz-als-terrorwaffe-142293129388
Videos geben Einblicke in die Lebenswelt einer «Drogengang»,https://www.tagesanzeiger.ch//diese-raketen-sind-eigentlich-zu-teuer-fuer-den-einsatz-als-terrorwaffe-142293129388
Genossenschaft übernimmt einen historischen Badgasthof,https://www.tagesanzeiger.ch//diese-raketen-sind-eigentlich-zu-teuer-fuer-den-einsatz-als-terrorwaffe-142293129388
