frontstory,url
"Arbeiten bis zum Umfallen? Nein, danke!",https://www.tagesanzeiger.ch//arbeiten-bis-zum-umfallen-nein-danke-659056344266
«Jetzt sparen» – Zürichs Regierung appelliert an Bevölkerung,https://www.tagesanzeiger.ch//arbeiten-bis-zum-umfallen-nein-danke-659056344266
Scholz will Luftverteidigung für Europa | Mordfall Dugina: Weiterer Tatverdächtiger,https://www.tagesanzeiger.ch//arbeiten-bis-zum-umfallen-nein-danke-659056344266
Solaranlagen auf Neubauten sollen Pflicht werden,https://www.tagesanzeiger.ch//arbeiten-bis-zum-umfallen-nein-danke-659056344266
Die Rückkehr der USA zum Mond verzögert sich,https://www.tagesanzeiger.ch//arbeiten-bis-zum-umfallen-nein-danke-659056344266
Können Hunde weinen?,https://www.tagesanzeiger.ch//arbeiten-bis-zum-umfallen-nein-danke-659056344266
