frontstory,url
Federer und Nadal fehlt ein Game zum Sieg,https://www.tagesanzeiger.ch//federers-letzter-tanz-mit-nadal-571290349519
Am Horizont die Hoffnung,https://www.tagesanzeiger.ch//federers-letzter-tanz-mit-nadal-571290349519
"Wer nicht Ja sagt zum Anschluss an Russland, riskiert sein Leben",https://www.tagesanzeiger.ch//federers-letzter-tanz-mit-nadal-571290349519
Was der SNB-Entscheid für Anlegerinnen und Sparer bedeutet,https://www.tagesanzeiger.ch//federers-letzter-tanz-mit-nadal-571290349519
"Und wenn der Strom zu teuer wird, leben sie halt ohne Licht",https://www.tagesanzeiger.ch//federers-letzter-tanz-mit-nadal-571290349519
"«Sollte das Kopftuch fallen, ist das ein Signal an die Bevölkerung»",https://www.tagesanzeiger.ch//federers-letzter-tanz-mit-nadal-571290349519
