frontstory,url
"Federer-Rekorde, die in Gefahr sind – und solche, die ihm wohl ewig bleiben",https://www.tagesanzeiger.ch//federer-rekorde-die-in-gefahr-sind-und-solche-die-ihm-wohl-ewig-bleiben-491458500512
Sie beginnen das Medizinstudium mit einer Woche im Spital,https://www.tagesanzeiger.ch//federer-rekorde-die-in-gefahr-sind-und-solche-die-ihm-wohl-ewig-bleiben-491458500512
Bundesrat verurteilt die Schein­referenden in der Ukraine und bestellt rus­sischen Botschafter ein,https://www.tagesanzeiger.ch//federer-rekorde-die-in-gefahr-sind-und-solche-die-ihm-wohl-ewig-bleiben-491458500512
Melonis Getöse ist höchstens halbstark,https://www.tagesanzeiger.ch//federer-rekorde-die-in-gefahr-sind-und-solche-die-ihm-wohl-ewig-bleiben-491458500512
"«Keine Ahnung, was ich in diesen Tausenden Stunden genau gemacht habe»",https://www.tagesanzeiger.ch//federer-rekorde-die-in-gefahr-sind-und-solche-die-ihm-wohl-ewig-bleiben-491458500512
Iranischer Präsident versetzt CNN-Moderatorin Amanpour wegen fehlendem Kopftuch,https://www.tagesanzeiger.ch//federer-rekorde-die-in-gefahr-sind-und-solche-die-ihm-wohl-ewig-bleiben-491458500512
