frontstory,url
Vollzeitjob? Nein danke,https://www.tagesanzeiger.ch//vollzeitjob-nein-danke-269417961378
Jetzt auch noch Mobbingvorwürfe,https://www.tagesanzeiger.ch//vollzeitjob-nein-danke-269417961378
Er braute in der Küche literweise ein «Krebs­medikament» zusammen,https://www.tagesanzeiger.ch//vollzeitjob-nein-danke-269417961378
Jetzt zoffen sie sich wieder,https://www.tagesanzeiger.ch//vollzeitjob-nein-danke-269417961378
Albert Rösti kann sich nur noch selbst schlagen,https://www.tagesanzeiger.ch//vollzeitjob-nein-danke-269417961378
Meghans Weg zur Albtraumprinzessin,https://www.tagesanzeiger.ch//vollzeitjob-nein-danke-269417961378
